from,to,text,time_start,time_end,comment
DR2-1,MAC144,mac one four four turn left heading of one seven zero,90.11,93.20,
MAC144,DR2-1,left to one seven zero mac six zero one four four,93.64,96.22,
DR2-1,MAC144,mac one four four climb and maintain one seven thousand,127.89,131.02,
MAC144,DR2-1,up to one seven thousand mac six zero one four four,131.02,134.71,
DR2-1,MAC144,mac one four four i need a good rate out of eleven thousand soon as i get you above a cessna i can get you on course,184.85,189.97,
MAC144,DR2-1,one four four a good rate through eleven,189.97,192.09,
DR2-1,MAC144,mac one four four turn right heading two one zero join j sixty one,204.76,208.55,
MAC144,DR2-1,right turn to two one zero now we'd like to level off about one five if we could,208.68,213.33,
DR2-1,MAC144,okay ah mac one four four maintain one five thousand and make that request from the center for a final,214.01,219.31,
MAC144,DR2-1,one four four level off at one five,220.28,222.10,
DR2-1,MAC144,mac one four four washington center one three three point niner tell them you want to stay at fifteen,222.75,227.37,
MAC144,DR2-1,say frequency again for one four four,229.26,231.30,
DR2-1,MAC144,thirty three nine,231.34,232.28,
MAC144,DR2-1,thirty three nine one four four thanks,234.13,236.24,
DR2-1,N78F,cessna seven eight foxtrot washington center one three three point niner,236.35,240.07,
N78F,DR2-1,thirty three nine seven eight fox,240.65,242.03,pilot omitted ident prefix
DR2-2,N99KW,november nine nine kilo whiskey climb and maintain one seven thousand proceed direct daily resume own navigation,453.80,458.67,aircraft apparently on another frequency
TWA744,DR2-2,saint louis depart ah correction washington departure t w a seven forty four out of a thousand climbing to five,461.76,470.38,
DR2-2,TWA744,t w a seven forty four washington radar contact climb and maintain one seven thousand,470.72,474.76,
TWA744,DR2-2,up one seven thousand t w a seven forty four,475.56,479.81,
N55KM,DR2-2,and departure triple five kilo mike's with you out of four hundred for two thousand good afternoon,533.13,537.03,
DR2-2,N55KM,november five five five kilo mike washington radar contact maintain three thousand five hundred have on course in three miles,537.50,543.69,
N55KM,DR2-2,we're out of six for three point five kilo mike,543.66,546.10,aircraft apparently on another frequency
DR2-2,N99KW,nine nine kilo whiskey one three three point niner,577.97,580.78,controller omitted ident prefix; aircraft apparently on another frequency
DR2-2,TWA744,t w a seven forty four turn right heading one two zero intercept armel zero nine one resume own navigation expedite climb through one four thousand,617.73,627.02,
TWA744,DR2-2,all right sir right turn to one two zero for the armel zero nine one radial expedite through fourteen climbing to seventeen t w a seven forty four,628.09,637.79,
DR2-2,TWA744,t w a seven forty four traffic two o'clock one five miles southwest bound one zero thousand,688.08,693.03,
TWA744,DR2-2,all right sir we're looking ah we don't have him on the machine or visually yet,694.17,698.71,
DR2-2,N55KM,november five kilo mike resume own navigation say on course heading,698.70,702.46,
N55KM,DR2-2,sir we're victor one twenty three at this time,702.72,704.72,
DR2-2,TWA744,t w a seven forty four traffic now twelve o'clock seven miles southwest bound descending out of nine thousand three hundred,747.48,753.71,
TWA744,DR2-2,all right sir we're looking no joy,755.07,756.95,
DR2-2,TWA744,t w a seven forty four traffic no factor contact washington center on one three four point five,788.14,793.75,
TWA744,DR2-2,thirty four five t w a seven forty four good day sir,793.67,797.92,
N55KM,DR2-2,and washington any chance of five point five for kilo mike,815.71,819.33,
DR2-2,N55KM,five kilo mike climb and maintain five thousand five hundred,819.38,822.35,aircraft apparently on another frequency
N55KM,DR2-2,very good out of three point five for five point five kilo mike,822.58,825.58,pilot omitted ident prefix
DR2-2,N55KM,five kilo mike contact baltimore on one two four point five five good day,848.59,852.56,controller omitted ident prefix
N40MC,DR2-2,departure lear jet four four zero mike charlie with you eighteen hundred for two thousand,956.66,961.24,
DR2-2,N40MC,november four four zero mike charlie washington radar contact climb and maintain four thousand,961.66,967.21,
N40MC,DR2-2,climb to four thousand mike charlie,967.19,968.86,
N00AC,DR2-2,and departure king air four hundred alpha charlie's with you through seven hundred feet,986.21,989.72,
DR2-2,N40MC,four four zero mike charlie fly heading zero seven zero vector dulles final correction baltimore final,1006.42,1012.90,controller omitted ident prefix
N40MC,DR2-2,right to zero seven zero mike charlie,1013.33,1015.13,pilot omitted ident prefix
N00AC,DR2-2,departure king four hundred alpha charlie's out of one point five,1019.71,1022.90,
DR2-2,N00AC,four zero zero alpha charlie washington radar contact climb and maintain four thousand five hundred v f r,1024.39,1030.23,controller omitted ident prefix
N00AC,DR2-2,ah roger v f r to four thousand five hundred four hundred alpha charlie,1030.03,1034.17,pilot omitted ident prefix
N305,DR2-2,washington departure three zero five is with you going through three hundred,1037.58,1042.03,
DR2-2,N305,november three eight three zero five washington roger radar contact maintain two thousand five hundred,1042.15,1047.12,
N305,DR2-2,three zero five up to two point five,1046.72,1048.80,pilot omitted ident prefix
DR2-2,N40MC,lear four zero mike charlie contact baltimore on one one nine point seven,1061.51,1066.32,
N40MC,DR2-2,nineteen seven mike charlie,1066.52,1068.15,pilot omitted ident prefix
DR2-2,N00AC,four zero zero alpha charlie turn right heading zero eight zero traffic twelve o'clock ten miles southwest bound descending to two correction descending to five thousand,1069.45,1077.98,controller omitted ident prefix
N00AC,DR2-2,ah roger right to zero eight zero four hundred alpha charlie we'll be looking for that traffic,1077.34,1081.70,pilot omitted ident prefix
DAL1756,DR2-2,departure delta seventeen fifty six is with you out of one thousand climbing to five thousand,1114.70,1119.06,
DR2-2,DAL1756,delta seventeen fifty six washington radar contact climb and maintain flight level one nine zero,1119.08,1124.30,
DAL1756,DR2-2,climbing to one nine zero delta seventeen fifty six,1124.71,1126.97,
DR2-2,N00AC,november zero alpha charlie traffic no factor climb and maintain nine thousand five hundred,1147.03,1152.07,
N00AC,DR2-2,ah roger sir up to nine thousand five hundred four hundred alpha charlie,1153.27,1157.46,pilot omitted ident prefix
DR2-2,N305,november three eight three oh five resume own navigation contact andrews one one nine point three,1198.83,1203.68,
N37WH,DR2-2,departure good afternoon three seven whiskey hotel's with you we're out of two thousand feet on the way to five on the river,1209.98,1214.78,
DR2-2,N37WH,november three seven whiskey hotel washington radar contact climb and maintain one seven thousand,1214.83,1219.91,
N37WH,DR2-2,cleared to seventeen one seven thousand three seven whiskey hotel thank you,1220.05,1222.75,pilot omitted ident prefix
DR2-2,N00AC,november four zero zero alpha charlie turn right to heading one five zero vector from baltimore airspace,1239.30,1245.90,
N00AC,DR2-2,right to one five zero four hundred alpha charlie,1246.06,1248.62,pilot omitted ident prefix
DR2-2,DAL1756,delta seventeen fifty six turn right to heading zero seven zero intercept kenton two seven one radial resume own navigation,1251.53,1258.44,
DAL1756,DR2-2,delta seventeen fifty six right turn heading zero seven zero join the kenton two seven one degree radial our own navigation,1258.57,1265.47,
DR2-2,N00AC,november four zero zero alpha charlie baltimore's accepted the handoff resume own navigation and contact them now one two four point five five,1283.82,1291.83,
N00AC,DR2-2,roger resume own navigation and ah twenty four fifty five for four hundred alpha charlie good day,1292.03,1297.84,pilot omitted ident prefix
DR2-2,N37WH,november three seven ah whiskey hotel turn right heading one one zero,1301.26,1306.06,
N37WH,DR2-2,right turn heading one one zero three seven whiskey hotel,1306.18,1308.53,pilot omitted ident prefix
DR2-2,DAL1756,delta seventeen fifty six expedite climb through one four thousand,1308.73,1312.34,
DAL1756,DR2-2,expedite climb through one four thousand delta seventeen fifty six you need that by the two two zero degree of baltimore,1312.49,1319.03,
DR2-2,N37WH,november three seven whiskey hotel maintain present airspeed till advised overtaking traffic ahead two o'clock four miles,1320.04,1326.89,
N37WH,DR2-2,okay ah two hundred and fifty knots till advised three seven whiskey hotel we got that well we had the traffic in sight we're in the clouds now,1326.95,1332.63,
N51MK,DR2-2,ah washington it's king air eight five one mike kilo with you climbing for two,1335.32,1338.65,
DR2-2,N51MK,november eight five one mike kilo washington radar contact climb and maintain four thousand five hundred,1342.64,1347.92,
N51MK,DR2-2,one mike kilo on up to four thousand five hundred,1347.89,1350.73,pilot omitted ident prefix
DR2-2,N51MK,november one mike kilo turn left heading three six zero,1358.26,1362.18,
N51MK,DR2-2,three six zero for mike kilo,1362.84,1364.76,pilot omitted ident prefix
DR2-2,N37WH,november three seven whiskey hotel traffic no factor normal airspeed direct nottingham resume own navigation,1404.49,1410.66,
N37WH,DR2-2,okay normal airspeed direct nottingham flight plan three seven whiskey hotel thank you,1410.52,1414.15,pilot omitted ident prefix
DR2-2,DAL1756,delta seventeen fifty six contact washington center on one three four point five,1451.98,1457.10,
DAL1756,DR2-2,one three four point five delta seventeen fifty six good day,1457.35,1460.37,
N25GE,DR2-2,washington departure king air two five golf echo's out of twelve hundred heading zero six zero,1472.48,1477.21,
DR2-2,N25GE,november two five golf echo washington roger radar contact climb and maintain four thousand,1477.42,1482.39,
N25GE,DR2-2,up to four thousand golf echo,1482.39,1484.14,pilot omitted ident prefix
DR2-2,N51MK,november one mike kilo climb and maintain five thousand five hundred,1487.98,1492.25,
N51MK,DR2-2,okay one mike kilo on up to five thousand five hundred,1492.65,1495.40,pilot omitted ident prefix
DR2-2,N51MK,november one mike kilo contact baltimore on one two eight point seven resume own navigation,1495.92,1500.69,
N51MK,DR2-2,okay twenty eight point seven ah thanks a lot,1501.54,1504.65,
N37WH,DR2-2,and november three seven whiskey hotel's leveling one seven thousand,1512.46,1515.07,
DR2-2,N37WH,three seven whiskey hotel roger waiting on center to take the handoff,1515.11,1519.38,controller omitted ident prefix
N37WH,DR2-2,okay,1519.45,1520.16,
N11PH,DR2-2,washington approach skylane one one papa hotel,1521.19,1523.54,
DR2-2,N37WH,three seven whiskey hotel they've just now taken it call them one three three point nine good day they'll have higher for you in just a second,1529.33,1535.71,controller omitted ident prefix
N37WH,DR2-2,okay great one thirty three point nine three seven whiskey hotel thank you much sir so long,1535.76,1539.14,pilot omitted ident prefix
DR2-2,N25GE,november two five golf echo turn left heading three four zero join victor two sixty five resume own navigation,1538.92,1544.61,
N25GE,DR2-2,left to three four zero to join two sixty five golf echo,1544.80,1548.39,pilot omitted ident prefix
N11PH,DR2-2,washington approach skylane one one papa hotel,1558.09,1561.13,
N11PH,DR2-2,washington approach skylane one one papa hotel,1585.01,1587.36,
DR2-2,N11PH,skylane one one papa hotel washington approach go ahead,1589.84,1592.34,
N11PH,DR2-2,ah one one papa hotel we're at two thousand about two miles ah south of ah gaithersburg flying to norfolk via andrews,1592.48,1600.01,pilot omitted ident prefix
DR2-2,N11PH,one one papa hotel your transmission's breaking up try it again,1602.59,1606.00,controller omitted ident prefix
N11PH,DR2-2,one one papa hotel two miles south of ah gaithersburg level two thousand flying to norfolk via andrews,1606.22,1613.27,pilot omitted ident prefix
DR2-2,N11PH,one one papa hotel squawk four three seven four remain outside of the t c a till radar identified,1621.57,1627.03,controller omitted ident prefix
N11PH,DR2-2,wilco,1627.06,1627.90,
DR2-2,N25GE,king air five golf echo climb and maintain five thousand,1630.91,1634.17,
N25GE,DR2-2,four for five thousand golf echo,1633.95,1635.96,pilot omitted ident prefix
DR2-2,N12CT,two charlie tango washington approach,1663.95,1666.00,controller omitted ident prefix
N12CT,DR2-2,yeah charlie tango's here,1667.98,1669.35,pilot omitted ident prefix
DR2-2,N12CT,two charlie tango contact the tower please you're on departure frequency,1671.49,1674.52,controller omitted ident prefix
DR2-2,N25GE,king air five golf echo contact baltimore approach on one two ah correction one two eight point seven,1679.97,1685.87,
N25GE,DR2-2,twenty eight point seven for two five golf echo good day,1686.08,1688.71,
DR2-2,N25GE,day,1688.79,1689.26,
DR2-2,N11PH,one one papa hotel radar contact five miles southeast of montgomery county airport climb and maintain two thousand five hundred you're cleared to enter the washington t c a,1690.19,1698.43,controller omitted ident prefix
N11PH,DR2-2,okay we'd like go up to thirty five hundred when able,1698.62,1700.80,
DR2-2,N11PH,ah one one papa hotel say the type aircraft,1706.37,1708.92,controller omitted ident prefix
N11PH,DR2-2,ah we're a cessna one eighty two slash u,1709.08,1710.92,
N12CT,DR2-2,washington departure falcon one one two charlie tango climbing to two thousand,1797.56,1801.53,
DR2-2,N12CT,falcon one one two charlie tango washington departure radar contact,1801.59,1805.26,
DR2-2,N12CT,one one two charlie tango turn left heading zero two zero climb and maintain three thousand,1814.82,1820.35,controller omitted ident prefix
N12CT,DR2-2,left to zero two zero climb to three thousand charlie tango,1820.45,1823.60,pilot omitted ident prefix
HNA4484,DR2-2,and departure henson forty four eighty four is going up to anacostia zero six zero out of seven hundred,1854.49,1859.93,
DR2-2,HNA4484,henson forty four eighty four washington departure roger radar contact,1859.88,1863.28,
HNA4484,DR2-2,thank you,1863.31,1863.90,
DR2-2,N12CT,falcon one one two charlie tango climb and maintain one one thousand,1870.69,1874.34,
N12CT,DR2-2,climb to one one thousand twelve charlie tango,1874.32,1876.63,pilot omitted ident prefix
DR2-2,HNA4484,henson forty four eighty four radar contact a mile northeast of the airport traffic at two o'clock and ah four miles turning westbound heavy seven forty seven,1885.77,1894.17,
HNA4484,DR2-2,yes sir we have him in sight,1894.29,1895.65,
DR2-2,HNA4484,thank you maintain visual separation,1895.73,1897.51,
HNA4484,DR2-2,okay,1897.85,1898.79,
DR2-2,N12CT,one one two charlie tango turn right ah heading one zero zero intercept the armel zero nine one radial to paleo,1900.99,1908.35,controller omitted ident prefix
N12CT,DR2-2,okay ah one zero zero heading for the armel zero nine one charlie tango,1908.78,1912.77,pilot omitted ident prefix
DR2-2,HNA4484,henson forty four eighty four additional traffic at twelve o'clock and one zero miles correction six miles opposite direction it's a king air v f r at three thousand,1949.75,1959.34,
HNA4484,DR2-2,okay we're looking,1959.37,1960.57,
HNA4484,DR2-2,we have him,1986.33,1987.43,
DR2-2,HNA4484,henson forty four eighty four climb and maintain four thousand turn right heading zero nine zero,2004.29,2008.64,
HNA4484,DR2-2,zero nine zero four thousand forty four eighty four,2008.64,2012.10,pilot omitted ident prefix
DR2-2,N11PH,november one one papa hotel climb and maintain three thousand five hundred,2018.67,2021.89,
N11PH,DR2-2,thirty five hundred one papa hotel,2022.02,2023.83,pilot omitted ident prefix
DR2-2,N11PH,one papa hotel traffic twelve o'clock three miles southwest bound is a king air thirty five hundred,2028.82,2033.81,controller omitted ident prefix
N11PH,DR2-2,we're looking one papa hotel,2033.78,2035.28,pilot omitted ident prefix
DR2-2,N12CT,falcon two charlie tango contact baltimore approach one two four point five five good day,2037.64,2042.51,
N12CT,DR2-2,one two four five five charlie tango,2042.63,2044.59,pilot omitted ident prefix
DR2-2,N11PH,one one papa hotel turn left heading ah one six zero be a short vector for traffic,2086.40,2091.93,controller omitted ident prefix
N11PH,DR2-2,one six zero one papa hotel,2092.02,2093.44,pilot omitted ident prefix
DR2-2,HNA4484,henson forty four eighty four contact baltimore approach one two ah correction one one niner point seven,2127.36,2133.27,
HNA4484,DR2-2,nineteen seven good day,2133.10,2134.36,
DR2-2,HNA4484,thanks,2134.77,2135.54,
NAE4941,DR2-2,eagle forty nine forty one is ah with you out of a thousand,2202.90,2206.21,
DR2-2,NAE4941,eagle forty nine forty one washington departure roger radar contact climb and maintain ah four thousand,2206.83,2213.02,
NAE4941,DR2-2,four thousand forty nine forty one,2213.03,2215.11,pilot omitted ident prefix
DR2-2,N29A,calling washington approach say again,2229.40,2231.32,
N29A,DR2-2,aztec six six two nine alpha forty five hundred information sierra,2231.57,2235.94,
DR2-2,N29A,aztec six six two niner alpha washington approach roger information tango is current at national airport proceed direct washington expect runway three three,2236.13,2244.79,
N29A,DR2-2,proceed direct to washington for three three two nine alpha,2244.79,2248.39,pilot omitted ident prefix
DR2-2,N29A,two nine alpha traffic ten o'clock four miles opposite direction a dash eight four thousand i f r,2248.40,2253.98,controller omitted ident prefix
N29A,DR2-2,two nine alpha roger,2254.06,2255.72,pilot omitted ident prefix
DR2-2,N11PH,one papa hotel turn left heading one five zero,2262.32,2264.58,controller omitted ident prefix
N11PH,DR2-2,one five zero one papa hotel,2264.74,2266.38,pilot omitted ident prefix
N29A,DR2-2,aztec two nine alpha tally ho on traffic,2266.65,2269.63,
DR2-2,N29A,two nine alpha roger,2269.70,2271.08,controller omitted ident prefix
DR2-2,N29A,six six two niner alpha descend and maintain three thousand five hundred,2295.71,2299.73,controller omitted ident prefix
N29A,DR2-2,down to three thousand five hundred two nine alpha,2299.84,2303.07,pilot omitted ident prefix
DR2-2,NAE4941,eagle forty nine forty one climb and maintain niner thousand,2303.60,2307.01,
NAE4941,DR2-2,niner thousand forty nine forty one,2307.14,2308.72,pilot omitted ident prefix
DR2-2,N29A,six six two niner alpha turn left heading two one zero,2354.26,2357.87,controller omitted ident prefix
N29A,DR2-2,left two one zero two nine alpha,2357.86,2359.99,pilot omitted ident prefix
DR2-2,NAE4941,eagle forty nine forty one turn right heading zero nine zero intercept the andrews zero six seven radial paleo,2362.16,2367.88,
NAE4941,DR2-2,zero nine zero to the airway forty nine forty one,2367.84,2370.79,pilot omitted ident prefix
DR2-2,NAE4941,eagle forty nine forty one contact baltimore approach one two four point five five good day,2388.80,2393.58,
NAE4941,DR2-2,twenty four fifty five forty nine forty one,2393.72,2396.46,pilot omitted ident prefix
DR2-2,N29A,six six two nine alpha fly heading two four zero,2468.85,2471.92,controller omitted ident prefix
N29A,DR2-2,two four zero two nine alpha,2472.08,2473.99,pilot omitted ident prefix
DR2-2,N29A,aztec two nine alpha contact washington approach on one two four point two,2481.47,2486.27,
N29A,DR2-2,one twenty four point two two nine alpha,2486.47,2488.79,pilot omitted ident prefix
DR2-2,N11PH,cessna one papa hotel position's ah one mile west of nottingham vortac resume own navigation to norfolk,2519.10,2526.18,
N11PH,DR2-2,wilco one papa hotel,2526.07,2527.50,pilot omitted ident prefix
N71H,DR2-2,departure lear nine,2582.64,2584.26,
N71H,DR2-2,departure lear nine seven one hotel's with you out of ah one thousand eight hundred climbing to five thousand,2584.89,2590.13,
DR2-2,N71H,lear nine seven one hotel washington departure radar contact climb and maintain niner thousand,2590.27,2594.99,
N71H,DR2-2,niner thousand seven one hotel,2594.93,2597.99,pilot omitted ident prefix
NWA1842,DR2-2,departure northwest eighteen forty two out of one point three,2649.68,2653.09,
DR2-2,NWA1842,northwest eighteen forty two washington departure radar contact climb and maintain niner thousand,2653.17,2658.29,
NWA1842,DR2-2,niner thousand eighteen forty two,2658.49,2660.33,pilot omitted ident prefix
DR2-2,N71H,lear nine seven one hotel turn right heading one four zero climb and maintain one seven thousand,2684.51,2689.16,
N71H,DR2-2,climbing to one four ah i'm sorry turning right one four zero and the altitude,2689.16,2695.63,
DR2-2,N71H,altitude one seven thousand one seven hotel,2695.62,2698.95,controller omitted ident prefix
DR2-2,HNA4545,henson forty five forty five washington departure radar contact,2713.63,2716.75,
HNA4545,DR2-2,thank you,2717.09,2717.77,
DR2-2,HNA4545,henson forty five forty five intercept victor two sixty five ah northbound climb and maintain four thousand,2730.03,2736.58,
HNA4545,DR2-2,okay four thousand victor two sixty five northbound forty five forty five,2736.63,2741.08,pilot omitted ident prefix
DR2-2,NWA1842,northwest eighteen forty two turn right heading zero seven zero intercept the kenton two seven one radial swann,2764.81,2770.34,
NWA1842,DR2-2,zero seven zero join up northwest eighteen seventy two,2770.82,2774.01,
VENUS81,DR2-2,departure venus eight one out of one thousand three hundred for three thousand runway heading,2775.55,2779.78,
DR2-2,VENUS81,venus eight one washington departure radar contact v f r traffic ten o'clock two miles southwest bound altitude unknown,2779.97,2785.48,
VENUS81,DR2-2,venus eight one negative contact,2786.22,2788.51,
N14QS,DR2-2,citation two one four quebec sierra one point eight for five thousand,2789.69,2793.68,
DR2-2,N14QS,citation four quebec sierra washington departure radar contact climb and maintain niner thousand,2793.80,2798.47,
N14QS,DR2-2,nine thousand four quebec sierra,2798.49,2800.11,pilot omitted ident prefix
DR2-2,N71H,lear seven one hotel cleared direct nottingham join j sixty one on course,2802.89,2806.99,
N71H,DR2-2,seventy one hotel thank you,2806.76,2808.72,pilot omitted ident prefix
DR2-2,NWA1842,northwest eighteen forty two climb and maintain one seven thousand expedite climb through one four thousand,2808.68,2813.23,
NWA1842,DR2-2,up to one seven thousand expedite through one four thousand northwest eighteen forty two,2813.47,2818.61,
DR2-2,NWA1842,thank you,2818.73,2819.59,
DR2-2,VENUS81,venus eight one v f r traffic no longer a factor turn left heading three five zero climb and maintain ah three thousand,2821.00,2827.31,
VENUS81,DR2-2,left to three five zero up fi- five thousand for ah venus eight one,2827.29,2831.36,
VENUS81,DR2-2,and was that five thousand for venus eight one,2833.52,2835.77,
DR2-2,VENUS81,ah no sir three thousand,2835.85,2837.33,
VENUS81,DR2-2,three thousand venus eight one,2837.41,2838.83,
DR2-2,VENUS81,thank you,2838.85,2839.79,
USA1248,DR2-2,departure u s air twelve forty eight is with you out of one thousand for five thousand,2848.54,2852.57,
DR2-2,HNA4545,henson forty five forty five turn left heading three three zero this be vectors to join victor two fourteen,2866.95,2872.45,
HNA4545,DR2-2,okay three three zero forty five forty five,2872.43,2875.70,pilot omitted ident prefix
DR2-2,VENUS81,venus eight one climb ah proceed direct westminister,2875.68,2878.76,
VENUS81,DR2-2,venus eight one direct westminister,2879.51,2881.57,
DR2-2,N11PH,one papa hotel contact patuxent approach one two zero point zero five,2897.70,2902.18,
N11PH,DR2-2,one two zero zero five one one papa hotel,2901.79,2904.14,pilot omitted ident prefix
DR2-2,N14QS,november two one four quebec sierra turn right heading zero seven zero intercept the kenton two seventy one radial swann,2904.07,2909.40,
N14QS,DR2-2,zero seven zero to join ah four quebec sierra,2909.48,2912.20,pilot omitted ident prefix
DR2-2,N71H,lear seven one hotel contact washington center one three three point niner good day,2912.03,2916.17,
N71H,DR2-2,thirty three nine good day seven one hotel,2916.27,2918.72,pilot omitted ident prefix
N80SC,DR2-2,two eighty sierra charlie out of thirteen hundred for two,2918.63,2921.85,transmission garbled due to two aircraft transmitting simultaneously
N80SC,DR2-2,two eighty sierra charlie out of thirteen hundred for two,2923.77,2926.44,pilot omitted ident prefix
DR2-2,N80SC,two eight zero sierra charlie washington departure radar contact intercept victor two sixty five on course,2926.48,2931.39,controller omitted ident prefix
N80SC,DR2-2,eighty sierra charlie,2931.42,2932.81,pilot omitted ident prefix
DR2-2,HNA4545,henson forty five forty five climb and maintain five thousand,2932.81,2935.87,
HNA4545,DR2-2,out of four for five forty five forty five,2935.92,2938.07,pilot omitted ident prefix
DR2-2,VENUS81,venus eight one climb and maintain five thousand,2937.88,2940.26,
VENUS81,DR2-2,out of three for five thousand venus eight one,2940.30,2942.98,
DR2-2,VENUS81,venus eight one contact baltimore approach one two eight point seven good day,2942.96,2946.55,
VENUS81,DR2-2,twenty eight seven,2946.62,2947.59,
DR2-2,N14QS,november two one four quebec sierra climb and maintain one seven thousand,2947.64,2952.04,
N14QS,DR2-2,one seven thousand four quebec sierra,2952.05,2953.98,pilot omitted ident prefix
MAC152,DR2-2,mac six zero one five two level three thousand,2954.36,2956.75,
