from,to,text,time_start,time_end,comment
DR2-2,MAC152,mac six zero one five two heavy washington departure radar contact three northeast of andrews turn right proceed direct to nottingham,2956.74,2962.92,
MAC152,DR2-2,right direct nottingham six zero one five two,2962.91,2965.36,
DR2-2,HNA4545,henson forty five forty five contact baltimore approach one two eight point seven,2990.31,2994.63,
HNA4545,DR2-2,twenty eight seven so long,2995.07,2996.51,
USA1248,DR2-2,got higher for u s air twelve forty eight,2998.12,3000.17,
DR2-2,USA1248,ah u s air twelve forty eight climb and maintain niner thousand,3000.87,3004.27,
USA1248,DR2-2,niner thousand u s air twelve forty eight,3004.81,3006.99,
DR2-2,NWA1842,northwest eighteen forty two contact washington center one three four point five thanks for the climb,3028.66,3034.11,
NWA1842,DR2-2,thirty four five so long now,3034.00,3036.40,
DR2-2,N80SC,november two eight zero sierra charlie climb and maintain five thousand,3036.61,3040.18,
N80SC,DR2-2,climbing to five thousand two eighty sierra charlie,3040.12,3042.52,
DR2-2,N14QS,citation four quebec sierra what's your indicated speed,3044.28,3047.51,
DR2-2,N14QS,four quebec sierra contact washington center one three four point five good day,3049.54,3053.25,controller omitted ident prefix
N14QS,DR2-2,thirty four five good day,3053.27,3054.81,
DR2-2,USA1248,u s air twelve forty eight turn right heading one three zero,3054.86,3057.54,
USA1248,DR2-2,right to one thirty u s air twelve forty eight,3057.54,3060.12,
COA316,DR2-2,departure continental three sixteen is out of a thousand feet,3074.12,3076.95,
DR2-2,COA316,continental three sixteen washington departure radar contact,3077.00,3080.38,
MAC152,DR2-2,departure ah from mac six zero one five two what do you want us to do after nottingham,3112.29,3117.25,
DR2-2,MAC152,mac six zero one five two join j sixty one flight plan route,3118.14,3121.49,
MAC152,DR2-2,join jet sixty one flight plan route maintaining three,3121.79,3124.88,
DR2-2,USA1248,u s air twelve forty eight climb and maintain one seven thousand do not exceed two hundred and fifty knots,3126.36,3131.20,
USA1248,DR2-2,one seven thousand two hundred and fifty restricted u s air fourteen correction twelve forty eight,3131.24,3136.93,
N14QS,DR2-2,citation ah four quebec ah disregard,3137.12,3139.90,
DR2-2,N80SC,king air zero sierra charlie contact baltimore approach one two eight point seven good day,3140.54,3145.27,
N80SC,DR2-2,twenty eight seven eighty sierra charlie so long,3145.22,3147.26,pilot omitted ident prefix
DR2-2,MAC152,mac six zero one five two heavy climb and maintain one seven thousand,3150.07,3153.67,
MAC152,DR2-2,up to one seven thousand mac six zero one five two,3153.69,3156.03,
DR2-2,USA1248,u s air twelve forty eight join the kenton two seven one radial resume own navigation climb and maintain flight level two three zero,3183.95,3190.75,
USA1248,DR2-2,join the two seventy one two three zero u s air twelve forty eight,3191.24,3194.76,
DR2-2,COA316,continental three sixteen climb and maintain niner thousand turn right heading one two zero,3205.84,3210.54,
COA316,DR2-2,ah niner thousand right to one twenty continental three sixteen,3210.54,3214.37,
DR2-2,USA1248,u s air twelve forty eight contact washington center one three four point five good day,3213.86,3218.24,
USA1248,DR2-2,thirty four and a half we'll see you now u s air twelve forty eight,3218.51,3221.24,
DR2-2,MAC152,mac one five two heavy contact washington center one three three point niner,3223.39,3227.79,
MAC152,DR2-2,thirty three niner for five one five two good day,3227.90,3230.26,
HNA4428,DR2-2,departure henson forty four twenty eight is with you out of six hundred for two thousand,3234.18,3238.44,
DR2-2,HNA4428,henson forty four twenty eight washington departure radar contact traffic at one o'clock five miles opposite direction descending to three thousand is a ah merlin,3238.50,3247.62,
HNA4428,DR2-2,ah yes sir we have him in sight henson forty four twenty eight,3248.45,3252.19,
DR2-2,HNA4428,thank you,3252.08,3253.05,
DR2-2,COA316,continental three sixteen climb and maintain one seven thousand,3264.53,3268.31,
COA316,DR2-2,climb to one seven thousand continental three sixteen,3268.31,3270.92,
TPS6480,DR2-2,departure trump sixty four eighty at nine hundred feet,3279.70,3282.78,
DR2-2,TPS6480,trump sixty four eighty washington departure radar contact climb and maintain niner thousand,3282.83,3287.42,
TPS6480,DR2-2,climbing nine thousand trump sixty four eighty,3287.16,3289.83,
DR2-2,HNA4428,henson forty four twenty eight climb and maintain four thousand additional traffic twelve to eleven o'clock five miles southwest bound at five,3301.30,3309.02,
HNA4428,DR2-2,looking for the other piece and we're going up to ah four thousand forty four twenty eight we have him in sight,3309.51,3314.53,pilot omitted ident prefix
DR2-2,HNA4428,thank you,3314.58,3315.26,
DR2-2,COA316,continental three sixteen intercept the armel zero nine one radial paleo resume own navigation,3318.77,3323.67,
COA316,DR2-2,intercept the armel zero nine one on course continental three sixteen,3323.63,3326.98,
DR2-2,COA316,continental three sixteen contact washington center one three four point five good day,3355.80,3360.76,
COA316,DR2-2,thirty four five continental three sixteen so long,3360.34,3363.31,
DR2-2,HNA4428,henson forty four twenty eight turn right heading zero eight zero climb and maintain seven thousand,3370.49,3376.52,
HNA4428,DR2-2,zero eight zero up to seven forty four twenty eight,3376.58,3379.45,pilot omitted ident prefix
HNA4510,DR2-2,and henson forty five ten with you we're leveling two,3380.03,3382.85,
DR2-2,HNA4510,henson forty five ten washington departure roger radar contact,3385.92,3389.88,
DR2-2,HNA4510,henson forty five ten climb and maintain three thousand company traffic one o'clock two and a half miles east bound out of thirty five hundred climbing,3405.50,3413.48,
HNA4510,DR2-2,henson forty five ten roger we're climbing to three we have the traffic in sight,3413.55,3418.23,
DR2-2,HNA4510,okay,3418.06,3418.90,
DR2-2,HNA4428,henson forty four twenty eight turn right heading one zero zero intercept the andrews zero six seven radial to paleo,3420.13,3426.46,
HNA4428,DR2-2,one zero zero intercept the radial and go to paleo henson forty four twenty eight,3426.49,3430.81,
DR2-2,TPS6480,trump sixty four eighty turn right heading zero eight zero intercept the kenton two seventy one radial swann,3430.65,3435.35,
TPS6480,DR2-2,heading zero eight zero and intercept kenton radial trump sixty four eighty,3435.61,3439.31,
USA1972,DR2-2,u s air nineteen seventy two is with you out of two for five,3446.18,3449.19,
DR2-2,USA1972,u s air nineteen seventy two washington departure radar contact climb and maintain niner thousand,3449.09,3453.97,
USA1972,DR2-2,nine thousand,3454.03,3454.89,
DR2-2,HNA4510,henson forty five ten turn right heading one ah four zero,3461.03,3464.63,
HNA4510,DR2-2,one four zero henson forty five ten,3464.47,3466.90,
DR2-2,TPS6480,trump sixty four eighty climb and maintain flight level one niner zero,3471.38,3475.30,
TPS6480,DR2-2,climb to one niner zero trump sixty four eighty,3475.74,3478.60,
DR2-2,HNA4428,henson forty four twenty eight contact baltimore approach one two four point five five good day,3495.09,3499.96,
HNA4428,DR2-2,one twenty four fifty five forty four twenty eight so long,3499.92,3502.52,pilot omitted ident prefix
DR2-2,USA1972,u s air nineteen seventy two turn right heading zero seven zero intercept the kenton two seven one radial to swann,3541.51,3547.50,
USA1972,DR2-2,zero seven zero for the intercept u s air nineteen seventy two,3547.44,3550.50,
DR2-2,TPS6480,trump sixty four eighty ah what's your planned speed on climb out,3550.79,3554.60,
TPS6480,DR2-2,three hundred knots,3558.18,3559.71,
DR2-2,TPS6480,thank you trump sixty four eighty contact washington center one three four point five,3559.76,3563.75,
TPS6480,DR2-2,one three four five trump sixty four eighty,3563.86,3566.18,
DR2-2,USA1972,u s air nineteen seventy two climb and maintain one zero thousand do not exceed two hundred and eighty knots indicated in the climb,3566.36,3572.61,
USA1972,DR2-2,ah ten thousand two hundred and eighty knots u s air nineteen seventy two,3572.81,3576.24,
DR2-2,HNA4510,henson forty five ten climb and maintain four thousand,3581.87,3584.99,
HNA4510,DR2-2,four thousand henson forty five ten,3585.12,3587.18,
