from,to,text,time_start,time_end,comment
FE-1,N3CK ,november three charlie kilo i understand that sir you can turn left now to three six zero,2047.28,2050.84,
FE-1,SWA41 ,southwest forty one ah fly heading one three zero contact approach on two five point two,2054.07,2058.07,
SWA41,FE-1 ,one thirty on the heading twenty five two ah southwest forty one so long,2058.67,2062.06,
FE-1,N00J ,november ah five zero zero juliet approach understand level one zero one one thousand,2067.70,2071.81,
FE-1,N00J ,roger advise if you have india expect the i l s three five right depart hamak heading one eight zero,2073.29,2077.56,
FE-1,SWA162 ,southwest ah correction one sixty two contact approach on one two five point two,2097.23,2101.64,
FE-1,N4LG ,saber four lima golf descend and maintain six thousand,2134.68,2137.10,
N4LG,FE-1,okay we're out of eleven for six four lima golf ,2137.80,2140.00,weak transmission
FE-1,AAL347 ,american three forty seven descend and maintain six thousand contact approach one one niner point four,2140.76,2145.06,
AAL347,FE-1 ,six thousand nineteen four good day ,2145.82,2148.74,weak transmission
FE-1,AAL347 ,good day sir,2148.90,2149.64,
FE-1,MDW317 ,midway three seventeen reduce speed two one zero,2150.28,2152.48,
MDW317,FE-1 ,slow to two one zero midway three seventeen,2152.75,2154.35,
FE-1,USA514 ,u s air five fourteen regional approach depart hamak heading one eight zero i l s three five right,2158.38,2162.57,
USA514,FE-1 ,hamak one eight zero vectors three five right u s air five fourteen ,2163.91,2167.67,weak transmission
FE-1,N3CK ,november three charlie kilo turn left heading three four zero,2179.63,2181.81,
FE-1,MDW317 ,midway three seventeen when at two hundred and ten knots descend and maintain six thousand,2203.58,2207.06,
MDW317,FE-1 ,when slowed down to six thousand midway ah three seventeen,2208.19,2211.38,
FE-1,N3CK ,november three charlie kilo descend and maintain four thousand contact approach on one two four point three,2233.48,2237.71,
N3CK,FE-1 ,four thousand twenty four three charlie kilo ,2237.83,2239.93,weak transmission
FE-1,N4LG ,november four lima golf descend and maintain five thousand,2313.00,2315.41,
FE-1,MDW317 ,midway three seventeen contact approach one one niner point four,2325.60,2328.19,
MDW317,FE-1 ,one one niner point four midway three seventeen,2328.44,2330.23,
FE-1,N00J ,westwind five hundred juliet reduce speed to ah two one zero,2333.76,2336.97,
FE-1,AAL178 ,american one seventy eight approach,2341.94,2343.44,
FE-1,N4LG ,november lima golf contact approach on one two zero point five,2353.93,2357.02,
AAL178,FE-1 ,approach american one seventy eight one one thousand,2365.63,2367.64,
FE-1,AAL178 ,american one seventy eight approach descend and maintain six thousand,2367.68,2370.01,
AAL178,FE-1 ,out of eleven for six american one seventy eight,2370.27,2372.72,
FE-1,DAL199 ,delta one ninety nine heavy regional approach depart ports heading two eight zero join the localizer three one right expect the i l s approach,2391.51,2397.08,
FE-1,AAL178 ,american one seventy eight expect the i l s three five right,2403.91,2406.33,
AAL178,FE-1 ,we'll expect three five right and the last speed we got was two hundred and fifty knots american one seventy eight,2406.78,2411.49,
FE-1,AAL178 ,yeah i seen that but that's okay it's working out pretty good for me right now,2411.64,2414.78,
AAL178,FE-1 ,okay,2415.01,2415.48,
FE-1,N00J ,lear five hundred juliet descend and maintain six thousand best rate through one zero thousand,2434.71,2438.59,
FE-1,DAL199 ,delta one ninety nine heavy descend and maintain five thousand contact approach one two five point two,2443.93,2448.15,
FE-1,MTR984 ,metro nine eighty four regional approach depart weder heading two zero zero expect the i l s three one right,2475.06,2479.92,
SWA449,FE-1 ,southwest four forty nine is with you we're ah descending to one one thousand presently out of eleven six,2484.51,2488.87,
FE-1,SWA449 ,southwest four forty nine regional approach roger,2489.18,2491.42,
FE-1,AAL178 ,american one seventy eight reduce speed to ah ah disregard on the speed reduction now turn right heading one seven zero,2492.49,2497.94,
AAL178,FE-1 ,one seventy we'll keep our speed american one seventy eight,2498.15,2500.75,
FE-1,AAL178 ,american one seventy eight contact approach one nineteen point four,2507.08,2509.46,
AAL178,FE-1 ,nineteen four good day american one seventy eight,2509.84,2511.76,
FE-1,SWA449 ,ah southwest four forty nine descend and maintain one zero thousand,2514.99,2517.81,
SWA449,FE-1 ,roger down to ten thousand southwest ah four forty nine leaving eleven,2519.14,2522.53,
FE-1,N00J ,november five zero zero juliet continue descent to six thousand contact approach one one niner point four,2522.97,2527.13,
N00J,FE-1 ,nineteen four five hundred juliet so long,2527.41,2529.61,
FE-1,N00J ,good day,2529.77,2530.23,
FE-1,UNK ,calling approach say again please,2535.44,2536.68,
N53L,FE-1 ,falcon six five three lima level level at seven with juliet,2536.80,2540.19,
N53L,FE-1 ,two zero five off holts five three lima,2544.84,2547.52,
FE-1,N31H ,gulfstream three three one hotel regional approach roger,2558.51,2561.12,
FE-1,UNK ,roger,2564.51,2565.01,
FE-1,SWA449 ,southwest four forty nine descend and maintain eight thousand,2567.11,2569.17,
SWA449,FE-1 ,eight thousand southwest four forty nine,2570.27,2571.79,
FE-1,N14S ,november seven one ah four sierra regional approach roger depart holts heading of two zero five,2587.24,2591.98,
FE-1,N14S ,and reduce speed to two five ah zero one four sierra,2595.95,2598.77,
FE-1,N14S ,all right reduce speed forty knots,2603.19,2605.17,
FE-1,SWA449 ,southwest forty nine ah turn left heading of zero niner zero,2618.88,2621.89,
SWA449,FE-1 ,zero nine zero southwest four forty nine,2622.13,2623.94,
FE-1,USA514 ,u s air five fourteen descend and maintain eight thousand,2627.28,2630.08,
USA514,FE-1 ,eight thousand u s air five fourteen,2630.62,2632.78,
FE-1,SWA449 ,southwest four forty nine descend and maintain six thousand when you're steady on a heading of zero nine zero,2632.86,2636.83,
SWA449,FE-1 ,okay down to six thousand southwest ah four forty nine heading zero nine zero,2637.45,2641.66,
FE-1,SWA449 ,southwest four forty nine turn back right heading one two zero,2647.15,2649.65,
SWA449,FE-1 ,okay heading one two zero southwest four forty nine,2650.05,2652.09,
FE-1,N61U ,november four eight six one uniform ah regional approach after ah scurry if that's where you're cleared to proceed direct redbird,2658.18,2663.94,
FE-1,N31H ,november three one hotel descend and maintain four thousand and contact approach one two five point two,2666.80,2670.96,
FE-1,SWA449 ,southwest four forty nine continue descent to six thousand and fly heading one ah three zero,2674.43,2678.55,
SWA449,FE-1 ,heading one three zero down to six thousand southwest four forty nine,2678.79,2681.82,
FE-1,USA514 ,u s air five forty four descend and maintain seven correction five fourteen descend and maintain seven thousand,2684.91,2689.69,
USA514,FE-1 ,seven thousand u s air five fourteen,2690.39,2692.61,
FE-1,SWA449 ,southwest four forty nine contact approach on one one er correction one two five point two,2711.90,2716.01,
USA514,FE-1 ,six thousand and one one niner point four good day,2724.71,2727.51,
FE-1,USA514 ,good day sir,2727.61,2728.11,
FE-1,N53L ,november five three lima let the next controller know that i'll get you started down here shortly,2734.43,2738.36,
N53L,FE-1 ,okay,2738.50,2739.48,
FE-1,N53L ,november five three lima turn left heading one eight zero vector for traffic,2740.84,2743.73,
N53L,FE-1 ,heading one eighty five three lima,2743.96,2745.74,
N74B,FE-1 ,approach falcon one seven four bravo seven thousand juliet,2754.28,2758.35,
FE-1,N74B ,falcon one seven four bravo regional approach ah roger,2758.41,2761.27,
FE-1,N61U ,november four eight six one uniform contact approach one two five point two,2762.10,2765.27,
FE-1,N53L ,november five three lima descend and maintain ah five thousand contact approach one two five point two,2772.11,2776.88,
N53L,FE-1 ,five three lima is out of seven for five twenty five two so long,2777.08,2780.08,
FE-1,N53L ,good day,2780.18,2780.72,
FE-1,N14S ,lear one four sierra fly heading of two one zero,2784.96,2787.32,
FE-1,N14S ,lear one four sierra descend and maintain five thousand,2790.74,2792.90,
FE-1,N74B ,november one four bravo descend and maintain ah four thousand correction seven four bravo descend and maintain four thousand,2807.85,2813.57,
N74B,FE-1 ,seven for four thousand seven four bravo,2813.85,2817.24,
FE-1,N74B ,november seven four bravo contact approach on ah one two five point two,2820.36,2823.51,
N74B,FE-1 ,one twenty five two we'll see you,2823.99,2825.64,
FE-1,MTR984 ,metro nine eight four descend and maintain five thousand contact approach one two five point two,2834.04,2838.29,
FE-1,N14S ,lear one four sierra descend and maintain five thousand,2854.95,2857.08,
FE-1,N14S ,okay thanks,2861.87,2862.93,
FE-1,N14S ,lear one four sierra turn left heading one nine zero contact approach one two five point two,2885.25,2889.20,
FE-1,N14S ,good day,2891.57,2892.03,
FE-1,SWA43 ,southwest forty three regional approach depart holts heading of ah two one zero,2911.20,2915.07,
FE-1,SWA43 ,southwest forty three descend and maintain five thousand,3007.30,3009.67,
FE-1,SWA43 ,southwest forty three contact approach one two five point two,3145.37,3148.04,
SWA43,FE-1 ,twenty five two we'll see you,3148.18,3149.09,
FE-1,SWA252 ,southwest two fifty two regional approach heading three three zero join the three one left localizer,3358.75,3363.43,
FE-1,ASA337 ,asea three thirty seven regional approach fly heading two eight five expect one of the north parallels,3447.99,3453.32,
FE-1,SWA232 ,southwest two thirty two descend and maintain five thousand,3457.27,3460.93,
FE-1,SWA232 ,southwest two thirty two descend and maintain four thousand contact approach one two five point two,3476.05,3482.02,
OPS2752,FE-1 ,regional approach opsco twenty seven fifty two heavy descending to one one thousand with india,3521.59,3526.45,
FE-1,OPS2752 ,opsco twenty seven fifty two heavy regional approach roger,3526.66,3529.66,
