from,to,text,time_start,time_end,comment
FE-1,AAL627,american six twenty seven plan the i l s three five right localizer frequency is one niner zero point one,2607.91,2612.05,
AAL627,FE-1,american six twenty seven,2612.42,2613.47,
AAL1441,FE-1,approach american fourteen forty one's with you twelve thousand with papa,2614.31,2617.83,
FE-1,AAL1441,american fourteen forty one regional approach thank you,2618.07,2620.04,
FE-1,N51HC,citation one zero hotel charlie descend and maintain six thousand,2621.16,2624.27,controller seems to misstate call sign again -jjg
N51HC,FE-1,down to six hotel charlie here we go,2624.47,2626.58,
FE-1,N51HC,roger,2626.89,2627.27,
FE-1,MTR902,metro nine zero two turn right heading two one zero,2630.17,2632.40,
MTR902,FE-1,two one zero for metro nine zero two,2632.69,2634.47,
FE-1,MTR902,metro nine zero two correct contact approach now one two five point two,2634.50,2637.40,
MTR902,FE-1,roger,2638.46,2638.78,
FE-1,UAL725,united seven twenty five regional approach thank you information papa is now current altimeter three zero three zero,2655.23,2659.50,
UAL725,FE-1,yeah we have papa united seven twenty five,2659.87,2661.86,
FE-1,AAL1153,american's eleven fifty three descend and maintain one one thousand,2666.56,2669.06,
AAL1153,FE-1,descending to eleven thousand american eleven fifty three,2670.74,2672.99,
FE-1,AAL1153,that's correct american eleven fifty three plan the i l s three five right localizer is one zero niner one,2673.28,2677.81,
AAL1153,FE-1,american eleven fifty three roger,2678.34,2679.79,
FE-1,AAL1117,american eleven seventeen turn left ten degrees descend and maintain five thousand,2680.33,2683.67,
FE-1,AAL1117,roger,2688.35,2688.73,
AAL373,FE-1,approach american three seventy three is with you at eleven papa,2689.66,2692.52,
FE-1,AAL373,american three seventy three regional approach depart porks heading two eight zero,2692.99,2695.88,
AAL373,FE-1,two eight zero out of porks american three seventy three,2696.93,2699.08,
FE-1,HUS1216,hustler twelve seventeen plan the ah correction hustler twelve sixteen expect the i l s runway three one right approach maintain five thousand,2700.04,2706.38,
FE-1,HUS1216,hustler twelve seven ah sixteen that's correct turn left heading one ah five zero,2710.72,2714.65,
HUS1216,FE-1,one five zero,2714.92,2718.78,very distorted
FE-1,AAL1117,american eleven seventeen descend and maintain five thousand over,2728.55,2730.96,
AAL1117,FE-1,yes sir down to five thousand american seventeen,2731.74,2733.65,
FE-1,AAL1117,thank you,2733.97,2734.32,
FE-1,AAL627,american six twenty seven fly heading one eight zero descend and maintain six thousand,2734.65,2737.68,
AAL627,FE-1,one eighty heading down to six american ah six twenty seven,2738.48,2742.08,
FE-1,AAL373,american three seventy three descend and maintain eight thousand,2742.33,2744.61,
AAL373,FE-1,eight thousand american three seventy three,2744.71,2746.81,
FE-1,HUS1216,hustler twelve sixteen contact approach on one two five point two and tell em your heading,2747.81,2751.09,
FE-1,HUS1216,roger,2754.05,2754.47,
AAL237,FE-1,american two thirty seven twelve for eleven slowing,2754.65,2757.10,
FE-1,N51HC,ah citation one hotel charlie turn left heading one seven zero,2758.47,2761.26,
N51HC,FE-1,left one seven zero hotel charlie,2761.86,2763.46,
FE-1,AAL237,who else called,2763.88,2764.58,
AAL237,FE-1,american two thirty seven out of twelve for eleven,2764.64,2767.80,
FE-1,AAL237,american two thirty seven regional approach depart porks heading two eight zero,2768.89,2771.99,
AAL237,FE-1,two eight oh out of porks american two thirty seven,2772.15,2774.36,
FE-1,AAL373,american three seven three expect the i l s runway three five right localizer is one zero niner point one,2783.13,2788.01,
AAL373,FE-1,okay american three seventy three that was the three five right localizer,2790.58,2794.07,
FE-1,AAL373,yes sir,2794.73,2795.15,
FE-1,AAL237,american two thirty seven heading two eight zero intercept three one right localizer fly it inbound descend and maintain five thousand,2795.69,2800.78,
AAL237,FE-1,three one right and ah three hundred degrees on the heading two eighty degrees excuse me and intercept the localizer american two thirty seven,2800.84,2809.35,
FE-1,AAL1117,american eleven seventeen contact approach one one niner point four,2809.58,2812.19,
AAL1117,FE-1,nineteen four american eleven seventeen,2814.40,2816.08,
FE-1,AAL627,american six twenty seven contact approach one one niner point four,2816.32,2818.81,
AAL627,FE-1,nineteen four american six twenty seven,2819.76,2821.56,
FE-1,N51HC,citation one hotel charlie descend and maintain five thousand contact approach one two four point five,2821.74,2826.33,
N51HC,FE-1,twenty four five down to five we're out of six,2826.53,2828.36,
FE-1,N51HC,roger,2828.83,2829.29,
FE-1,AAL1153,american eleven fifty three fly heading one eight zero descend and maintain six thousand,2829.54,2832.95,
UNK,UNK,blocked,2833.90,2834.22,
AAL237,FE-1,i blocked you american two thirty seven cleared to eight thousand,2834.91,2837.37,
FE-1,AAL1153,american eleven fifty three is heading one eight zero and six thousand sir,2838.53,2841.19,
AAL1153,FE-1,one eight zero and six thousand for american eleven fifty three,2841.56,2845.30,
FE-1,AAL1153,that's correct,2845.41,2845.95,
FE-1,AAL237,american two thirty seven expedite your descent down to five thousand contact approach one two five point two,2846.23,2850.34,
AAL237,FE-1,five thousand one two five point two american two thirty seven,2850.77,2853.81,
FE-1,AAL373,american three seventy three turn left ten degrees,2854.16,2856.17,
AAL373,FE-1,left turn ten degrees american three seventy three,2856.68,2858.38,
SWA35,FE-1,southwest thirty five's at ah eleven thousand,2859.43,2861.86,
FE-1,SWA35,southwest thirty five regional approach roger,2862.71,2864.87,
USA1053,FE-1,usair ten fifty three is at one one thousand,2865.88,2867.76,
FE-1,USA1053,usair ten fifty three regional approach depart korks heading two seven zero,2868.04,2871.10,
USA1053,FE-1,two seventy out of korks u s air's ten fifty three,2871.24,2873.65,
AAL425,FE-1,american four twenty five at one two thousand,2875.52,2877.83,
FE-1,AAL425,american four twenty five regional approach roger papa is now current altimeter three zero three zero,2878.33,2882.04,
AAL425,FE-1,thank you,2882.48,2882.86,
AAL1337,FE-1,approach control american thirteen thirty seven at one two thousand we have papa,2883.75,2887.49,
FE-1,AAL1337,american thirteen thirty seven regional approach roger,2888.04,2890.45,
FE-1,AAL1151,american's ah eleven fifty three expedite descent now maintain six thousand contact approach now one one niner point four,2891.65,2896.73,
AAL1151,FE-1,nineteen four and we'll expedite eleven fifty three,2896.80,2899.73,
FE-1,USA1053,u s air ten fifty three descend and maintain eight thousand,2899.75,2902.30,
USA1053,FE-1,cleared down to eight u s air ten fifty three,2903.01,2904.50,
FE-1,SWA35,southwest thirty five fly heading one ah three zero descend and maintain eight thousand,2912.09,2915.97,
SWA35,FE-1,down to eight thousand we're heading one thirty,2916.25,2918.33,
FE-1,AAL1440,american fourteen forty one fly heading one eight zero plan the i l s three five right localizer frequency is one zero niner point one,2918.54,2924.06,
AAL1440,FE-1,heading one eight zero american fourteen forty one,2924.13,2926.13,
FE-1,UAL725,united seven twenty five expect the i l s three five right localizer frequency is one zero niner point one,2927.19,2931.95,
UAL725,FE-1,seven twenty five,2932.22,2933.24,
AAL423,FE-1,approach american four twenty three papa one one thousand,2937.33,2940.61,
FE-1,AAL423,american four twenty three regional approach depart porks heading two eight zero,2940.82,2943.73,
AAL423,FE-1,boids heading two eight zero american four two three,2944.39,2946.46,
FE-1,AAL423,that's porks sir,2946.80,2947.69,
FE-1,USA1053,u s air ten fifty three ah intercept the three one right localizer heading two eight zero fly it inbound descend and maintain five thousand,2951.88,2958.11,
USA1053,FE-1,two eight zero for ah three one right localizer and down to what five thousand,2958.64,2962.87,
FE-1,USA1053,yes sir,2962.92,2963.66,
FE-1,AAL373,american three seventy three descend and maintain five thousand,2963.92,2966.26,
AAL373,FE-1,five thousand american three seventy three,2966.33,2968.68,
FE-1,AAL373,roger,2968.95,2969.38,
FE-1,AAL425,american four twenty five expect the i l s three five right localizer one zero niner point one,2969.65,2973.80,
AAL425,FE-1,you were blocked,2975.42,2975.96,
FE-1,AAL425,american four twenty five expect i l s three five right localizer frequency is one zero niner point one,2976.35,2980.52,
AAL425,FE-1,thank you american four twenty five,2980.82,2982.24,
AAL883,FE-1,american eight eighty three twelve thousand papa,2983.45,2985.27,
FE-1,AAL883,american's eight eighty three regional approach roger,2985.45,2987.35,
FE-1,AAL373,american three seventy three continue descent maintain five thousand expedite to it contact approach one one niner point four,2990.39,2995.43,
AAL373,FE-1,expedite down to five one one nine four good day,2995.68,2997.85,
FE-1,USA1053,u s air ten fifty three expedite descent maintain five thousand contact approach one two five point two,2998.24,3002.54,
USA1053,FE-1,twenty five two and we're hurrying down to five u s air ten fifty three,3003.04,3005.58,
FE-1,AAL1441,american fourteen forty one descend and maintain niner thousand,3005.68,3008.04,
AAL1441,FE-1,niner thousand american fourteen forty one,3008.26,3010.05,
FE-1,UAL725,united seven twenty five fly heading one eight zero,3013.43,3015.69,
FE-1,UAL725,who was that,3021.17,3021.92,
UAL725,FE-1,united seven twenty five,3022.27,3023.55,
FE-1,UAL725,two one zero knots for united seven twenty five heading one eight zero and descend and maintain six thousand,3023.72,3028.29,
UAL725,FE-1,down to six thousand south slowing to two ten united seven twenty five,3028.47,3032.13,
SWA337,FE-1,southwest three thirty seven eight point three for seven thousand,3032.89,3035.57,
FE-1,SWA35,southwest thirty five descend and maintain six thousand,3038.21,3040.29,
SWA35,FE-1,six thousand southwest thirty five,3040.31,3041.96,
FE-1,AAL1441,american's fourteen forty one descend and maintain seven thousand,3042.77,3045.13,
AAL1441,FE-1,down to seven american fourteen forty one,3045.50,3047.32,
FE-1,AAL423,american four twenty three if you called fly heading two eight zero and intercept three one right localizer and fly it inbound,3047.34,3051.23,
AAL423,FE-1,okay ah heading two ah eight ah zero and intercept ah three one localizer and fly it inbound american four twenty three,3051.81,3058.40,
FE-1,AAL423,roger,3058.60,3059.04,
FE-1,SWA337,southwest three thirty seven regional approach roger continue descent and maintain five thousand vectors love,3064.19,3068.19,
AAL1337,FE-1,and approach american thirteen thirty seven,3070.77,3072.57,
FE-1,AAL1337,american thirteen thirty seven approach,3073.13,3074.67,
AAL1337,FE-1,i just wondered you did want us at one two thousand,3075.07,3077.30,
FE-1,AAL1337,affirmative,3077.63,3078.43,
FE-1,AAL423,american four twenty three descend and maintain five thousand,3087.56,3089.85,
AAL423,FE-1,out of eleven for five american four twenty three,3090.97,3092.76,
FE-1,SWA337,southwest three thirty seven descend and maintain three thousand,3093.57,3096.31,
SWA337,FE-1,down to three thousand southwest three thirty seven,3096.95,3098.90,
FE-1,AAL425,american four twenty five descend and maintain one one thousand,3099.19,3101.33,
AAL425,FE-1,down to one one thousand american four twenty five,3101.59,3103.60,
FE-1,SWA35,southwest thirty five turn left heading zero seven zero,3116.38,3118.53,
SWA35,FE-1,that's a left turn zero seven zero southwest thirty five,3119.40,3122.53,
FE-1,SWA35,that's correct,3122.57,3123.15,
FE-1,AAL1441,american fourteen forty one descend and maintain six thousand contact approach one one niner point four,3123.17,3127.14,
AAL1441,FE-1,six thousand and nineteen four american fourteen forty one,3127.18,3130.17,
FE-1,UAL725,untied seven twenty five amend that altitude maintain seven thousand,3131.43,3134.90,
UAL725,FE-1,seven thousand united seven twenty five,3135.35,3137.55,
FE-1,AAL425,american four twenty five fly heading one eight zero descend and maintain six thousand,3142.03,3144.89,
AAL425,FE-1,one eighty down to six american four twenty five,3145.18,3147.24,
FE-1,AAL423,american four twenty three contact approach one two five point two,3147.31,3149.94,
AAL423,FE-1,twenty five two so long,3150.29,3151.61,
FE-1,SWA35,southwest thirty five descend and maintain five thousand,3161.16,3163.47,
SWA35,FE-1,five thousand southwest thirty five,3163.75,3165.05,
FE-1,SWA35,southwest thirty five correct contact approach now on one two four point five fly heading one zero zero,3165.09,3169.86,
SWA35,FE-1,one hundred and ah one two four point five five southwest thirty five,3170.32,3173.50,
FE-1,UAL725,united seven twenty five descend and maintain six thousand contact approach one one niner point four,3181.48,3185.25,
UAL725,FE-1,down to six thousand ah nineteen four united seven twenty five,3186.55,3189.54,
FE-1,AAL305,american three zero five descend and maintain six thousand,3199.52,3201.79,
AAL305,FE-1,six thousand american three oh five,3202.34,3204.36,
FE-1,AAL1337,american thirteen thirty seven fly heading one eight zero descend and maintain six thousand,3204.74,3207.91,
AAL1337,FE-1,okay one eighty heading descending to six thousand american thirteen thirty seven,3208.24,3211.84,
AAL1355,FE-1,american thirteen fifty five twelve and a half for eleven papa,3214.44,3217.19,
FE-1,AAL1355,american thirteen fifty five regional approach fly heading two eight zero and intercept three one right localizer fly it inbound,3217.33,3221.68,
AAL1355,FE-1,two eighty for three one right american thirteen fifty five,3221.99,3224.14,
FE-1,SWA337,southwest three thirty seven turn left heading zero seven zero,3224.26,3227.31,
FE-1,AAL1379,american thirteen seventy nine regional approach roger,3229.20,3231.30,
FE-1,SWA337,southwest three thirty seven fly heading zero four zero,3231.60,3233.71,
SWA337,FE-1,zero four zero southwest three three seven,3233.76,3235.39,
FE-1,AAL883,american three correction american eight eighty three plan i l s three five right localizer one zero niner point one,3235.70,3240.22,
AAL883,FE-1,eight eighty three,3240.25,3240.84,
FE-1,AAL425,american four twenty five maintain six thousand approach one one niner point four,3241.63,3245.13,
AAL425,FE-1,nineteen four so long,3245.31,3246.31,
FE-1,UAL725,united seven twenty five it's one one niner point four for you,3246.47,3249.02,
FE-1,AAL883,american's eight eighty three descend and maintain one one thousand,3255.64,3257.91,
AAL883,FE-1,out of twelve for eleven eight eighty three,3258.25,3259.69,
FE-1,AAL305,american's three zero five descend and maintain five thousand and contact approach on one one niner point correction one two five point two,3261.12,3266.70,
AAL305,FE-1,down to five thousand twenty five two american three oh five,3267.12,3269.88,
FE-1,N5AT,nine five alpha tango roger turn left ten degrees maintain five thousand vectors love,3273.96,3277.64,
AAL1879,FE-1,american thirteen seventy nine one one thousand papa,3278.89,3281.54,
FE-1,AAL1355,american thirteen fifty five fly heading two eight zero and intercept three one right think i was blocked,3283.02,3286.65,
AAL1355,FE-1,ah yes sir we're going two eighty and intercept american thirteen fifty five,3287.44,3290.26,
FE-1,AAL1355,thirteen fifty five roger descend and maintain eight thousand,3290.43,3292.57,
AAL1355,FE-1,down to eight american thirteen fifty five,3292.78,3294.31,
FE-1,AAL1337,american thirteen thirty seven contact approach on one one niner point four,3294.50,3297.68,
AAL1337,FE-1,one nineteen four american thirteen thirty seven,3298.13,3300.30,
FE-1,SWA337,southwest three thirty seven contact approach one two four point five,3303.51,3306.34,
SWA337,FE-1,so long,3306.49,3306.98,
FE-1,SWA337,southwest three thirty seven approach one two four point five,3307.28,3309.83,
SWA337,FE-1,ah you were covered up there say again,3312.65,3314.44,
FE-1,SWA337,southwest three thirty seven approach one two four point five,3314.80,3317.10,
FE-1,AAL1337,american thirteen thirty seven contact approach on one one niner point four,3319.69,3322.39,
AAL1379,FE-1,american thirteen seventy nine we just passed baton one one thousand papa,3326.87,3330.73,
FE-1,AAL1379,american thirteen seventy nine regional approach roger expect i l s three five right localizer one zero niner point one,3330.99,3335.43,
N0MS,FE-1,regional approach lear one five zero mike sierra with you coming up on one one thousand with kilo,3336.34,3340.13,
FE-1,N0MS,lear one five zero mike sierra regional approach roger,3343.26,3345.46,
FE-1,AAL883,american eight eighty three fly heading one eight zero descend and maintain six thousand,3346.50,3349.57,
AAL883,FE-1,one eighty and six american eight eighty three,3349.73,3351.40,
FE-1,AAL1355,american thirteen fifty five maintain five thousand approach one two five point two,3351.59,3354.93,
AAL1355,FE-1,twenty five two five thousand american thirteen fifty five,3355.27,3357.71,
FE-1,AAL1355,roger,3357.99,3358.30,
FE-1,N0MS,lear one five zero mike sierra depart ah hamak heading two two zero vectors to meacham,3366.96,3370.48,
N0MS,FE-1,hamak two twenty one five zero mike sierra,3371.04,3372.78,
FE-1,N0MS,roger,3372.94,3373.52,
FE-1,N858,twin cessna nine eight eight five eight regional approach,3389.49,3392.40,
FE-1,AAL883,american's eight eighty three contact approach one one niner point four good day now,3396.18,3399.04,
AAL883,FE-1,so long,3399.08,3399.74,
MTR882,FE-1,go ahead,3417.41,3417.67,
FE-1,MTR882,metro eight eighty two approach,3421.28,3422.69,
MTR882,FE-1,go ahead,3423.19,3423.72,
FE-1,MTR882,metro eight eighty two depart weder heading two zero zero expect runway three one right,3423.95,3427.70,
MTR882,FE-1,two hundred off weder ah thirty one,3428.01,3430.63,
FE-1,N858,cessna eight five eight descend and maintain four thousand,3431.02,3433.32,
N858,FE-1,eight five eight out of five for four,3433.74,3435.26,
FE-1,N858,eight five eight roger vectors love let me know when you have victor,3436.09,3439.23,
AAL501,FE-1,approach american five oh one with you out of one three thousand seven hundred for one one thousand with papa,3441.13,3445.61,
FE-1,AAL501,american five zero one regional approach roger,3446.51,3448.35,
FE-1,N0GL,three zero golf lima regional approach roger depart holts heading two zero zero vectors love,3453.12,3457.27,
FE-1,SWA176,southwest one seventy six approach descend and maintain five thousand continue inbound on the three one left localizer,3463.45,3467.63,
SWA176,FE-1,all right down to five thousand for southwest one seventy six roger,3468.12,3470.82,
FE-1,SWA176,southwest one seventy six contact approach one two four point five,3471.46,3474.08,
SWA176,FE-1,twenty four five we'll see you,3474.52,3476.20,
FE-1,N858,cessna eight five eight fly heading three three zero contact approach one two four point five,3476.29,3479.75,
N858,FE-1,three three zero twenty four five,3480.49,3482.17,
FE-1,AAL883,roger american eight eighty three approach one one niner point four,3482.99,3485.59,
FE-1,AAL501,american five zero one reduce speed to two five zero and then resume the star,3487.55,3490.99,
AAL501,FE-1,two hundred and fifty knots and resume the star american five oh one,3491.43,3493.91,
FE-1,N0MS,lear five zero mike sierra do not slow below two hundred and fifty knots,3494.07,3496.98,
N0MS,FE-1,five zero mike sierra roger,3497.33,3498.71,
FE-1,N0MS,roger,3498.96,3499.39,
FE-1,AAL825,american eight twenty five if you called fly heading two eight zero expect three one right correction expect runway three five right,3499.84,3504.76,
AAL825,FE-1,eight twenty five just checked in or was trying to check in we're at eleven thousand you want a two eighty heading,3505.17,3509.29,
FE-1,N5AT,cheyenne five alpha tango expedite descent maintain three thousand,3510.49,3513.19,
N5AT,FE-1,okay we're out of five for three we'll expedite,3513.37,3515.08,
FE-1,N5AT,five alpha tango that's correct contact approach one two four point five,3515.42,3518.00,
N5AT,FE-1,bye,3518.21,3518.58,
FE-1,AAL1379,american thirteen seventy nine fly heading one eight zero,3519.02,3520.93,
AAL1379,FE-1,one eight zero american thirteen seventy nine,3521.16,3522.83,
FE-1,MTR882,metro's eight eighty two reduce speed to one niner zero and contact approach one two five point two,3523.17,3526.99,
MTR882,FE-1,one ninety and switching good day,3527.15,3528.65,
FE-1,AAL825,american eight twenty five heading two eight zero descend and maintain eight thousand vectors i l s ah three five right localizer frequency one zero niner point one,3529.05,3535.31,
FE-1,AAL825,roger,3539.59,3539.98,
FE-1,MTR898,metro eight ninety eight i think you tried,3540.27,3541.65,
FE-1,MTR898,metro eight ninety eight depart weder heading two zero zero expect runway three one right,3544.04,3547.57,
MTR898,FE-1,weder two zero zero metro eight ninety eight,3547.86,3549.85,
AAL533,FE-1,approach american five thirty three descending to eleven thousand with quebec,3551.39,3555.19,
FE-1,AAL533,american five thirty three regional approach roger depart porks heading two eight zero,3557.00,3560.25,
AAL533,FE-1,two eighty off porks,3560.25,3561.86,
FE-1,AAL1379,american thirteen seventy nine contact approach one one niner point four,3562.18,3564.80,
AAL1379,FE-1,nineteen four american thirteen seventy nine,3565.08,3566.78,
FE-1,AAL501,american five zero one expect the i l s three five right localizer one zero niner point one,3567.03,3570.62,
AAL501,FE-1,american five oh one,3570.90,3571.70,
FE-1,AAL501,roger,3572.11,3572.54,
FE-1,N3CA,three zero three charlie alpha just maintain six thousand,3572.81,3575.10,
N3CA,FE-1,three charlie alpha,3575.33,3576.28,
FE-1,N3CA,roger,3576.44,3576.96,
N33Y,FE-1,approach this is skylane three three yankee at six,3577.42,3579.82,
FE-1,N33Y,skylane three three ah yankee regional approach roger let me know when you've got victor for love,3580.31,3584.10,
N33Y,FE-1,roger i've got victor for love,3585.35,3587.00,
FE-1,N33Y,roger,3587.18,3587.83,
FE-1,MTR898,metro's eight ninety eight descend and maintain ah five thousand,3596.91,3599.74,
MTR898,FE-1,five thousand metro eight ninety eight,3601.05,3602.50,
FE-1,N0GL,lear three zero golf lima descend and maintain six thousand,3602.63,3604.85,
FE-1,N0MS,lear five zero mike sierra contact approach one two five point eight,3608.05,3610.76,
N0MS,FE-1,zero mike sierra twenty five eight bye,3610.81,3612.62,
FE-1,N0MS,roger,3612.88,3613.41,
FE-1,AAL533,american's five thirty three descend and maintain seven thousand,3622.67,3625.18,
AAL533,FE-1,and descending to seven american five thirty three,3625.63,3627.88,
FE-1,AAL825,american's eight twenty five descend and maintain five thousand,3628.22,3630.68,
AAL825,FE-1,down to five american eight twenty five,3630.99,3633.08,
AAL1289,FE-1,regional approach american twelve eighty nine passing twelve thousand two hundred for one one thousand papa,3638.36,3643.32,
FE-1,AAL1289,american regional approach roger,3643.57,3645.51,
FE-1,N0GL,lear three zero golf lima descend and maintain five thousand,3676.80,3679.15,
N0GL,FE-1,out of six for five golf lima,3679.24,3681.41,
FE-1,MTR898,metro eight ninety eight reduce speed to two one zero and contact approach on one two five point two,3681.77,3685.40,
MTR898,FE-1,two one zero and twenty five two metro eight ninety eight,3686.45,3688.60,
FE-1,MTR898,roger,3688.62,3689.06,
FE-1,AAL501,and american five zero one you can plan runway three five right localizer is one zero niner point one,3689.20,3693.20,
AAL501,FE-1,american five oh one roger,3693.49,3694.69,
FE-1,N33Y,skylane three three yankee proceed direct to love v o r when you're able,3720.27,3723.13,
N33Y,FE-1,roger,3723.99,3724.43,
FE-1,AAL825,american eight twenty five contact approach one one niner point four,3730.63,3733.06,
AAL825,FE-1,nineteen four good day,3733.39,3734.17,
FE-1,AAL533,american ah five thirty three descend and maintain five thousand,3734.50,3736.97,
AAL533,FE-1,five thousand five thirty three,3737.86,3739.43,
FE-1,N0GL,lear three zero golf lima reduce speed to two one zero,3742.17,3744.75,
N0GL,FE-1,two ten okay,3745.44,3746.73,
FE-1,N0GL,november three zero golf lima contact approach on one two four point ah five sir,3747.40,3751.78,
FE-1,N0GL,roger,3753.49,3754.04,
FE-1,AAL501,american five zero one fly heading one eight zero descend and maintain six thousand,3762.78,3765.83,
AAL501,FE-1,one eight zero out of eleven for six american five oh one,3766.08,3768.82,
FE-1,N33Y,cessna three three yankee descend and maintain four thousand,3775.37,3777.77,
N33Y,FE-1,three three yankee is out of four ah six for four,3778.81,3781.54,
STA97,FE-1,regional approach stern air ninety ah seven is with you at seven thousand with lima,3784.77,3789.17,
FE-1,STA97,stern air ninety seven regional approach depart holts heading two ah zero zero vectors addison,3790.04,3794.06,
FE-1,STA97,roger,3799.14,3799.59,
FE-1,AAL501,american five zero one contact approach one one niner point four,3803.05,3805.47,
AAL501,FE-1,one nineteen four american five oh one,3805.93,3807.38,
FE-1,AAL533,american five thirty three contact approach one one niner point four,3807.70,3810.29,
AAL533,FE-1,nineteen four so long,3810.54,3811.67,
FE-1,AAL533,bye,3811.79,3812.34,
FE-1,MTR806,metro eight zero six depart porks heading two eight zero,3824.32,3827.13,
