from,to,text,time_start,time_end,comment
MTR806,FE-1,okay we'll depart porks two eight zero for metro eight oh six,3827.89,3831.47,
FE-1,N3CA,mitsubishi three charlie alpha contact approach on one two five point eight,3835.67,3838.75,
N3CA,FE-1,three charlie alpha,3839.03,3840.39,
FE-1,MTR806,metro eight zero six heading two eight zero and intercept three one localizer and fly it inbound,3840.41,3844.06,
MTR806,FE-1,eight oh six roger,3844.61,3845.71,
FE-1,STA97,stern air ninety seven descend and maintain five thousand and contact approach approach one two four point three,3851.98,3855.81,
STA97,FE-1,out of seven for five one twenty four three ninety seven,3857.44,3860.06,
FE-1,N33Y,cessna three three yankee expedite your descent now and maintain four thousand contact approach now on one two four point five,3873.83,3878.89,
N33Y,FE-1,one twenty four five,3879.10,3880.13,
FE-1,MTR806,metro eight zero six descend and maintain five thousand contact approach on one two five point two,3896.55,3901.11,
MTR806,FE-1,twenty five point two out of seven for five thousand metro eight zero six,3901.35,3905.37,
