from,to,text,time_start,time_end,comment
USA14,LCW-2,is that for u s air fourteen,4556.56,4557.9,
USA14,LCW-2,say again for fourteen,4561.21,4562.42,
LCW-2,USA14,u s air fourteen traffic holding in position cross runway two two right contact ground point niner,4562.47,4567.25,
USA14,LCW-2,roger fourteen,4567.47,4568.55,
USA14,LCW-2,i got him,4575.47,4575.97,
LCW-2,N3AE,whiskey ah alpha echo roger,4577.79,4579.75,transmission not received from aircraft on another frequency
LCW-2,GAA565,bizex five sixty five contact departure,4579.86,4581.89,
LCW-2,GAA814,bizex eight fourteen fly heading two five zero contact departure,4584.04,4586.96,
GAA814,LCW-2,two five zero over to departure eight fourteen,4587.12,4589.24,
GAA565,LCW-2,and boston bizex five sixty five ah you want us to departure,4605.0,4607.98,
LCW-2,GAA565,bizex five sixty five affirmative contact departure i must have got blocked,4608.13,4611.31,
GAA565,LCW-2,okay see you later,4611.69,4612.59,
LCW-2,GAA565,see you,4612.82,4613.4,
LCW-2,COM905,commuter nine zero five after departure turn right heading ah three zero zero runway two two right cleared for takeoff,4632.13,4638.1,
COM905,LCW-2,cleared to go two two right and ah on departure three hundred nine oh five,4638.74,4642.9,
LCW-2,BTA3828,jet link thirty eight ah twenty eight boston tower runway two two right taxi into position and hold,4643.05,4647.48,
BTA3828,LCW-2,position and hold ah thirty eight twenty eight,4647.62,4649.69,
LCW-2,CG1472,coast guard one four seven two ident say altitude,4649.89,4652.17,
LCW-2,CG1472,coast guard one four seven two is radar contact ah one niner miles northeast of boston cleared to operate within the t c a via the tobin route outbound via the fenway route maintain v f r at or below one thousand while in the t c a,4662.14,4676.25,transmissions not received from military aircraft on another frequency
LCW-2,COM905,commuter nine zero five fly heading three zero zero contact departure,4681.5,4685.01,
COM905,LCW-2,three zero departure nine ah nine oh five roger,4685.51,4688.3,
LCW-2,TPS1130,trump eleven thirty boston tower traffic holding in position cross runway two two right contact ground point niner,4725.17,4729.77,
TPS1130,LCW-2,crossing two two right trump eleven thirty,4729.98,4731.66,
LCW-2,GAA506,bizex five zero six boston tower cross runway two two right contact ground point niner,4731.75,4735.39,
GAA506,LCW-2,cross two two right over to point niner five oh six,4735.56,4737.97,
LCW-2,TPS1130,trump you still with me give way to that shorts can you do it,4752.32,4754.68,
LCW-2,TPS1130,trump eleven thirty you still with me,4758.35,4759.63,
LCW-2,BTA3828,jet link thirty eight twenty eight after departure turn right heading three zero zero runway two two right cleared for takeoff,4803.71,4809.37,
BTA3828,LCW-2,all right right to three hundred after departure cleared for takeoff twenty two right,4809.48,4812.7,
DAL457,LCW-2,twenty two right position and hold delta four five seven,4818.21,4820.47,
USA522,LCW-2,all right,4846.41,4847.01,
LCW-2,DAL457,delta four fifty seven amend the hold ah no crossing runway two two right cleared for takeoff,4848.33,4852.27,
DAL457,LCW-2,okay delta four five seven runway two two right cleared for takeoff,4852.69,4856.08,
LCW-2,DAL663,delta six sixty three boston tower runway two two right taxi into position and hold,4856.75,4860.6,
LCW-2,DAL663,delta six sixty three boston tower runway two two right taxi into position and hold,4864.95,4869.03,
DAL663,LCW-2,position and hold two two right delta six sixty three,4869.01,4870.98,
LCW-2,BTA3828,jet link thirty eight twenty eight fly heading three zero zero contact departure,4871.57,4874.92,
BTA3828,LCW-2,thirty eight twenty eight you all have a good evening,4875.4,4877.04,
LCW-2,BTA3828,you do the same,4877.08,4877.96,
LCW-2,DAL663,delta six sixty three runway two two right cleared for takeoff,4930.04,4933.66,
DAL663,LCW-2,cleared for takeoff two two right delta six sixty three,4933.65,4935.27,
LCW-2,BTA3843,jet link thirty eight forty three boston tower runway two two right taxi into position and hold,4935.28,4939.44,
BTA3843,LCW-2,position and hold jet link thirty eight forty three,4940.14,4942.9,
LCW-2,DAL457,delta four fifty seven turn left heading one four zero contact departure,4943.07,4946.45,
DAL457,LCW-2,delta four five seven so long,4946.73,4947.94,
LCW-2,USA522,u s air five twenty two boston tower cross runway two two right give way to company traffic left to right contact ground point niner,4996.35,5003.31,
TPS1192,LCW-2,cross behind u s air go to ground trump eleven ninety two wilco,5013.75,5016.23,
LCW-2,DAL663,delta six sixty three fly heading one four zero contact departure,5016.7,5019.98,
DAL663,LCW-2,one four zero delta six sixty three good day,5020.52,5022.36,
LCW-2,DAL663,good day,5022.52,5023.28,
LCW-2,BTA3843,jet link thirty eight forty three after departure turn left heading one five zero runway two two right cleared for takeoff,5078.63,5083.44,
LCW-2,NERA3726,nera thirty seven twenty six boston tower runway two two right taxi into position and hold after departure turn right heading three zero zero,5087.05,5093.07,
NERA3726,LCW-2,position and hold two two right and heading three zero zero after departure,5093.81,5097.29,
LCW-2,CG1472,coast guard one four seven two tower,5103.47,5105.15,
LCW-2,CG1472,coast guard one four seven two roger,5136.23,5137.93,transmissions not received from military aircraft on another frequency
LCW-2,NERA3726,nera thirty seven twenty six runway two two right cleared for takeoff,5138.76,5141.52,
NERA3726,LCW-2,cleared for takeoff thirty seven twenty six,5142.7,5144.63,
LCW-2,ALO3724,allegheny thirty seven twenty four boston tower runway two two right taxi into position and hold after departure turn right heading two five zero,5144.96,5151.03,
ALO3726,LCW-2,position and hold two fifty after departure thirty seven ah twenty four,5152.15,5155.63,
LCW-2,BTA3843,jet link thirty eight forty three fly heading one five zero contact departure now good day,5155.75,5159.57,
BTA3843,LCW-2,going to departure good night jet link thirty eight forty three,5159.77,5161.95,
LCW-2,ALO3724,allegheny thirty seven twenty four previous departure will be a three hundred heading ah after departure turn right heading two five zero runway two two right cleared for takeoff,5185.92,5193.67,
ALO3724,LCW-2,two five zero cleared to go thirty seven twenty four,5193.74,5195.77,
LCW-2,NAE974,eagle flight nine seventy ah four boston tower runway two two right taxi into position and hold,5195.91,5200.85,
NAE974,LCW-2,position and hold eagle flight nine seventy four,5200.96,5202.84,
LCW-2,NERA3726,nera thirty seven twenty six turn right heading three zero zero now contact departure,5202.83,5206.67,
NERA3724,LCW-2,nera thirty seven twenty six,5207.28,5209.03,
LCW-2,NAE974,eagle flight nine seventy four previous departure will be on a two fifty heading after departure fly runway heading runway two two right cleared for takeoff,5240.2,5246.65,
NAE974,LCW-2,cleared to go ah runway heading ah forty nine seventy four we have him in sight thanks,5246.66,5250.36,pilot read back forty nine instead of nine
LCW-2,USA1473,u s air fourteen seventy three boston tower runway two two right taxi into position and hold will you be able to maintain visual separation with the previous a t r departure and turn left heading one four zero the a t r will be runway heading,5250.54,5262.0,
LCW-2,AL03724,allegheny thirty seven twenty four fly heading two five zero contact departure,5266.18,5269.7,
ALO3724,LCW-2,good night,5269.8,5270.34,
LCW-2,ALO3724,good day,5270.65,5271.21,
LCW-2,NAE974,eagle flight nine seventy four fly runway heading and contact departure,5285.56,5288.85,
LCW-2,NAE974,see you,5290.39,5290.99,
LCW-2,USA1473,u s air fourteen seventy three after departure maintain visual separation with previous departure on runway heading and turn left heading one four zero runway two two right cleared for takeoff,5295.01,5303.95,
USA1473,LCW-2,u s fourteen seventy three is rolling,5304.11,5305.7,pilot used incomplete prefix
LCW-2,NERA3745,nera thirty seven forty five boston tower runway two two right taxi into position and hold,5305.7,5309.98,
NERA3745,LCW-2,position and hold nera thirty seven forty five,5310.22,5312.5,
LCW-2,AAL848,american eight forty eight boston tower cross runway two two right traffic holding in position contact ground point niner,5348.5,5353.29,
AAL848,LCW-2,american eight forty eight cross two two right,5353.97,5355.86,
LCW-2,USA1473,u s air fourteen seventy three turn left heading one four zero contact departure now good day,5355.93,5359.92,
USA1473,LCW-2,take care,5359.84,5360.43,
LCW-2,NERA3745,nera thirty seven forty five after departure fly runway heading runway two two right cleared for takeoff,5376.7,5382.21,
NERA3745,LCW-2,two two right ah cleared to go nera thirty seven ah forty five,5382.82,5387.81,
LCW-2,AWE700,cactus seven hundred boston tower runway two two right taxi into position and hold traffic will cross down field,5387.9,5392.59,
AWE700,LCW-2,position and hold two two right cactus seven hundred roger,5392.73,5395.18,
AFR6433,LCW-2,ah boston air france six four three three heavy good evening,5397.14,5400.31,
AFR6433,LCW-2,okay we hold short runway ah two two right ah six four three three heavy,5410.68,5414.93,
LCW-2,AFR6433,air france six four three three heavy traffic will hold in position full length cross runway two two right and contact ground ah point niner,5421.3,5429.54,
AFR6433,LCW-2,contact ground point niner six four three three heavy,5431.53,5434.38,
LCW-2,PCN5523,precision fifty five twenty three boston tower traffic holding in position cross runway two two right contact ground point niner,5434.59,5440.39,
PCN5523,LCW-2,cross two two right then over to ground precision thirty five twenty three,5440.57,5444.07,
LCW-2,NERA3735,nera thirty seven thirty five fly runway heading contact ground,5444.09,5447.0,
NERA3745,LCW-2,ground ah okay you want us over to departure nera thirty seven forty five,5447.95,5451.37,
LCW-2,NERA3745,did i say ground nera thirty seven forty five nice catch ah you you pass contact departure,5451.4,5455.93,
NERA3745,LCW-2,ha ha see you later,5456.13,5457.23,
LCW-2,AFR6433,air france sixty four thirty three heavy cross runway two two right please,5461.49,5465.21,
LCW-2,AWE700,cactus seven hundred ah runway two two right cleared for takeoff,5521.83,5525.52,
AWE700,LCW-2,cleared for takeoff two two right cactus seven hundred roger,5525.78,5528.09,
LCW-2,NERA3688,nera thirty six eighty eight boston tower runway two two right taxi into position and hold after departure turn right heading three zero zero,5528.09,5533.73,
NERA3688,LCW-2,three zero zero position and hold thirty six eighty eight,5534.17,5537.19,
LCW-2,NERA3688,nera thirty six eighty eight cleared for takeoff,5569.29,5571.09,
NERA3688,LCW-2,thirty six eighty eight,5571.68,5572.86,
LCW-2,USA739,u s air seven thirty nine boston tower runway two two right taxi into position and hold,5574.92,5578.59,
USA739,LCW-2,position and hold u s air seven thirty nine,5579.4,5581.49,
LCW-2,AWE700,cactus seven hundred turn left heading one four zero contact departure good day,5581.51,5584.98,
AWE700,LCW-2,one four zero so long,5585.05,5586.25,
USA112,LCW-2,ah u s air one twelve is holding short on two two four,5605.04,5608.86,
LCW-2,USA112,u s air one twelve boston tower roger and move up to the ah hold bars and hold short please,5608.88,5613.5,
LCW-2,USA739,u s air seven thirty nine previous departure northbound runway two two right cleared for takeoff,5618.13,5622.45,
USA739,LCW-2,cleared for takeoff u s air seven thirty nine,5622.59,5624.77,
LCW-2,NERA3688,nera thirty six eighty eight fly heading three zero zero contact departure good day,5625.22,5628.91,
NERA3688,LCW-2,thirty six eighty eight over to departure thank you,5629.23,5631.64,
LCW-2,COA369,continental three sixty nine boston tower runway two two right taxi into position and hold traffic will cross down field,5638.97,5643.4,
COA369,LCW-2,position and hold continental three sixty nine,5643.65,5645.43,
LCW-2,USA112,u s air one twelve cross runway two two right traffic holding in position contact ground point niner,5665.13,5670.24,
USA112,LCW-2,crossing two two right ah u s air one twelve,5670.81,5674.54,
LCW-2,USA739,u s air seven thirty nine fly heading one five ah make that fly heading one four zero and contact departure,5674.86,5680.02,
USA739,LCW-2,u s air seven thirty nine good night,5680.61,5682.01,
LCW-2,USA739,good night to you,5682.08,5682.8,
LCW-2,COA369,continental three sixty nine the wind is two five zero at two zero runway two two right cleared for takeoff,5709.86,5717.09,
COA369,LCW-2,continental three sixty nine cleared to go off two two right,5717.88,5720.78,
LCW-2,NWA42,northwest four two heavy boston tower cross runway two two right continue to taxi to runway two two left monitor tower one one niner point one after crossing,5720.85,5728.06,
NWA42,LCW-2,nineteen one after crossing cross the right to the left northwest forty two heavy good night,5728.45,5732.46,
LCW-2,USA345,u s air three forty five boston tower caution for the jet blast from the heavy ah d c ten runway two two right taxi into position and hold that traffic will be going to twenty two left,5732.4,5740.53,
LCW-2,GAA378,bizex three seventy eight boston tower cross runway two two right contact ground point niner traffic will hold full length,5751.33,5756.71,
LCW-2,COA369,continental three sixty nine contact departure,5761.31,5763.44,
COA369,LCW-2,good day gentlemen continental three sixty nine,5763.83,5765.65,
LCW-2,USA345,u s air three forty five the wind is ah two five zero at two one runway two two right cleared for takeoff,5798.17,5804.7,
USA345,LCW-2,cleared for takeoff u s air three forty five,5805.1,5807.17,
LCW-2,PCN3510,precision thirty five ten boston tower runway two two right taxi into position and hold after departure turn right heading three zero zero,5807.21,5812.94,
PCN3510,LCW-2,position and hold on two two right and three hundred after departure precision thirty five ten,5813.16,5817.09,
LCW-2,PCN3510,precision thirty five ten runway two two right cleared for takeoff,5847.97,5850.27,
PCN3510,LCW-2,cleared to go two two right precision thirty five ten,5850.5,5852.8,
LCW-2,GAA549,bizex five forty nine runway two two right taxi into position and hold after departure turn left heading one five zero,5852.99,5857.72,
LCW-2,USA345,u s air three forty five fly heading one four zero contact departure,5860.9,5863.9,
USA345,LCW-2,good night thank you three forty five,5863.98,5865.6,
LCW-2,USA345,good day,5865.61,5866.12,
LCW-2,GAA549,bizex five forty nine after departure turn right heading one five zero runway two two right cleared for takeoff,5892.33,5896.65,
GAA549,LCW-2,cleared to go bizex five forty nine,5896.81,5898.28,
NERA3718,LCW-2,taxi and hold after departure three hundred for a heading thirty seven eighteen,5904.61,5908.61,
LCW-2,PCN3510,precision ah thirty five ten fly heading three zero zero contact departure,5908.74,5912.1,
PCN3510,LCW-2,good night sir,5912.39,5912.91,
LCW-2,PCN3510,good day,5913.32,5913.92,
LCW-2,NERA3718,nera thirty seven eighteen do not turn until the departure end of the runway runway two two right cleared for takeoff,5930.44,5935.34,
NERA3718,LCW-2,cleared for takeoff thirty seven eighteen,5937.15,5938.63,
LCW-2,PCN3581,precision thirty five eighty one boston tower runway two two right taxi into position and hold,5938.69,5942.48,
PCN3581,LCW-2,on and hold thirty five eighty one,5942.73,5944.38,
LCW-2,GAA549,bizex five forty nine turn left heading one five zero contact departure,5944.88,5948.18,
GAA549,LCW-2,five forty nine good day,5948.33,5949.27,
LCW-2,GAA549,good day,5949.42,5950.02,
LCW-2,DAL100,delta one hundred heavy boston tower cross runway two two right traffic holding in position contact ground point niner,5987.71,5992.41,
DAL100,LCW-2,cross two two right call ground delta one hundred heavy,5992.68,5994.97,
LCW-2,NERA3718,nera thirty seven eighteen turn right heading three zero zero contact departure thank you,5996.29,6000.03,
LCW-2,PCN3581,precision thirty five eighty one runway two two right cleared for takeoff,6051.49,6053.73,
PCN3581,LCW-2,thirty five eighty one,6053.75,6054.91,
MOW919,LCW-2,tower mohawk nine nineteen visual now on the two two right,6086.33,6089.39,
LCW-2,MOW919,mohawk nine nineteen boston tower runway two two right cleared to land wind two five zero at one six,6089.41,6093.83,
MOW919,LCW-2,two fifty at sixteen cleared to land on the right side thank you,6094.05,6096.84,
LCW-2,PCN3581,precision thirty five eighty one turn right heading ah three zero zero contact departure,6097.13,6101.27,
PCN3581,LCW-2,roger right to three zero zero,6101.48,6103.23,
LCW-2,N3AE,whiskey three alpha echo say again your destination,6130.96,6132.97,
LCW-2,N3AE,the western or the weston toll plaza area,6145.48,6148.33,
LCW-2,N3AE,okay i understand that sir and ah stand by,6152.36,6154.44,
LCW-2,N3AE,november three alpha echo squawk five one three two,6157.59,6160.44,transmissions not received from aircraft or helicopter on another frequency
LCW-2,BAW214,speedbird two one four heavy boston tower caution wake turbulence previous departure on the parallel runway a heavy d c ten boston tower runway two two right taxi into position and hold,6182.45,6190.24,
BAW214,LCW-2,into position and hold on two two right speedbird two one four heavy,6190.79,6193.81,
LCW-2,N3AE,whiskey three alpha echo ident say altitude,6193.87,6196.1,
LCW-2,N3AE,whiskey three alpha echo is radar contact four miles ah west of boston cleared out of the t c a as requested maintain v f r at or below one thousand,6200.88,6207.21,transmissions not received from aircraft or helicopter on another frequency
LCW-2,MOW919,mohawk nine nineteen ah turn right when able and ah contact ground point niner,6208.93,6213.05,
MOW919,LCW-2,point nine good night,6213.12,6214.08,
MOW919,LCW-2,mohawk nine nineteen is clearing of off of two two for nineteen alpha,6220.7,6225.29,
LCW-2,BAW214,speedbird two one four heavy runway two two right cleared for takeoff,6230.12,6232.86,
BAW214,LCW-2,cleared for takeoff two two right speedbird two one four heavy,6233.41,6236.13,
LCW-2,UAL354,united three fifty four boston tower move up to the next set of hold bars and hold short of runway two two right acknowledge hold,6236.72,6242.59,
UAL354,LCW-2,hold short of two two right united three five four,6243.43,6245.85,
LCW-2,TPS1141,trump eleven forty one boston tower caution wake turbulence for departing heavy boeing seven forty seven runway two two right taxi into position and hold,6256.48,6263.32,
TPS1141,LCW-2,on and hold eleven forty one,6263.45,6264.68,
LCW-2,UAL354,united three fifty four boston tower cross runway two two right traffic holding full length contact ground point niner,6301.81,6306.49,
UAL354,LCW-2,cross point nine,6306.93,6308.28,
LCW-2,GAA554,bizex five fifty four boston tower give way to united cross runway two two right contact ground point niner,6308.65,6313.88,
GAA554,LCW-2,give way to united and then ground ah point nine after crossing the runway five five four,6314.43,6318.45,
LCW-2,BAW214,speedbird two one four heavy turn left heading one four zero now contact departure,6318.82,6322.88,
LCW-2,BAW214,bye,6325.21,6325.67,
LCW-2,TPS1141,trump eleven forty one runway ah two two right cleared for takeoff,6379.41,6382.68,
TPS1141,LCW-2,cleared for takeoff,6383.66,6384.76,
LCW-2,USA191,u s air one ninety one boston tower runway two two right taxi into position and hold,6385.19,6388.82,
USA191,LCW-2,position and hold two two right u s air one ninety one,6389.11,6391.38,
TPS1141,LCW-2,and copy trump eleven forty one is rolling two two right,6393.25,6395.58,
LCW-2,TPS1141,trump eleven forty one roger,6395.61,6396.81,
LCW-2,USA191,u s air one ninety one runway two two right cleared for takeoff,6430.95,6433.59,
USA191,LCW-2,two two right cleared for takeoff u s air one ninety one,6434.34,6436.1,
LCW-2,N23H,lear seven two three hotel boston tower runway two two right taxi into position and hold,6436.11,6439.8,
N23H,LCW-2,two three hotel on to hold,6440.01,6441.53,
LCW-2,TPS1141,trump eleven forty one turn left heading one four zero now contact departure,6441.57,6444.95,
TPS1141,LCW-2,trump eleven forty one good evening,6445.39,6447.13,
LCW-2,TPS1141,good evening,6447.18,6447.66,
LCW-2,FDX1230,express twelve thirty boston tower cross runway two two right contact ground point niner traffic holding in position full length,6467.68,6473.09,
LCW-2,USA191,u s air one ninety one ah fly present heading,6489.98,6492.45,
LCW-2,USA191,u s air one ninety one turn further left now heading one four zero contact departure thank you,6520.43,6524.96,
USA191,LCW-2,one four zero good night,6525.16,6526.32,
LCW-2,N23H,lear seven two three hotel runway two two right cleared for takeoff,6543.14,6546.68,
N23H,LCW-2,cleared for takeoff two three hotel,6546.78,6548.34,
LCW-2,GAA622,bizex six twenty two boston tower runway two two right taxi into position and hold,6548.59,6552.06,
GAA622,LCW-2,position and hold two two right bizex six two two,6552.61,6555.01,
LCW-2,GAA622,bizex six twenty two after departure turn right heading three zero zero runway ah two two right cleared for takeoff,6586.71,6591.67,
GAA622,LCW-2,three hundred degrees after departure and two two right cleared for takeoff six twenty two,6591.89,6595.52,
LCW-2,VIR012,virgin zero one two heavy boston tower cross runway two two right continue your taxi to runway two two left monitor tower frequency one one niner point one after crossing runway two two right,6596.04,6605.51,
VIR012,LCW-2,okay cross two two right one one niner point one after crossing virgin twelve,6605.74,6609.21,
LCW-2,N23H,lear two three hotel turn left heading one four zero contact departure frequency one three three point zero,6609.26,6614.13,
N23H,LCW-2,two three hotel good day sir,6615.22,6616.64,
LCW-2,N23H,good day to you,6616.65,6617.36,
LCW-2,NERA3728,nera thirty seven twenty eight boston tower runway two two right taxi into position and hold,6630.15,6634.07,
NERA3728,LCW-2,pos and hold two two right thirty seven twenty eight,6634.45,6636.57,pos pronounced like pause
LCW-2,GAA622,bizex six twenty two fly heading three zero zero contact departure,6636.88,6639.93,
GAA622,LCW-2,good night now,6640.18,6641.08,
LCW-2,GAA622,night,6641.2,6641.94,
LCW-2,N3AE,ah sikorsky three alpha echo thank you ah radar services were terminated a while ago frequency change approved,6670.65,6676.29,transmission not received from aircraft or helicopter on another frequency
LCW-2,NERA3728,nera thirty seven twenty eight after departure turn right heading three zero zero runway ah two two right cleared for takeoff,6693.65,6699.24,
NERA3728,LCW-2,cleared to go and after departure three thirty thirty seven twenty eight,6700.45,6703.02,pilot seems to read back the wrong heading
LCW-2,GAA528,bizex five twenty eight boston tower runway two two right taxi into position and hold,6707.71,6711.7,
GAA528,LCW-2,position and hold five twenty eight,6711.96,6713.64,
LCW-2,NERA3728,nera thirty seven twenty eight fly heading three zero zero contact departure,6753.35,6756.89,
NERA3728,LCW-2,three zero zero departure see you later nera thirty seven twenty eight,6757.48,6759.52,
LCW-2,NERA3728,see you,6759.48,6760.08,
LCW-2,CFL1,care flight one skyways ah go ahead,6774.88,6776.83,
LCW-2,CFL1,care flight one cleared to operate within the t c a as requested ah wind two five zero at one seven the altimeter three zero one one traffic is a merlin just over the ah the ah southeast side of the channel now and on a northwest bound heading,6781.85,6794.16,transmissions not received from aircraft or helicopter on another frequency
LCW-2,GAA528,bizex five twenty eight boston tower after departure turn right heading two five zero runway two two right cleared for takeoff,6796.09,6800.52,
GAA528,LCW-2,okay two fifty on the heading cleared for takeoff five twenty eight,6801.15,6803.75,
LCW-2,N42U,navajo four two uniform hold short of runway two two right ah for wake turbulence there will be a departing heavy boeing seven forty seven on the parallel runway,6806.17,6813.68,
N42U,LCW-2,roger holding short of the right,6813.87,6815.28,
UNK,UNK,turn the strobes off please,6818.7,6820.33,
UNK,UNK,thank you,6824.53,6825.13,
N59U,LCW-2,okay five nine u to cross,6852.73,6854.73,
LCW-2,GAA528,bizex five twenty eight fly heading three zero zero contact departure,6857.8,6861.22,
GAA528,LCW-2,three hundred on the heading five twenty eight so long,6861.66,6863.68,
LCW-2,CFL1,care flight one thank you radar service terminated frequency change approved good night,6864.7,6867.93,transmission not received from aircraft or helicopter on another frequency
NWA1838,LCW-2,tower northwest eighteen thirty eight is with you clear of two seven,6871.42,6874.14,
LCW-2,NWA1838,northwest eighteen thirty eight boston tower cross runway two two right and contact ground point niner after crossing,6874.16,6878.98,
NWA1838,LCW-2,cross ah two two right and talk to ground northwest eighteen thirty eight,6879.34,6882.58,
LCW-2,N42U,navajo two zero four two uniform runway two two right taxi into position and hold caution wake turbulence previous departure on the parallel runway was a heavy boeing seven forty seven,6916.63,6925.75,
LCW-2,N42U,navajo two zero four two uniform after departure turn right heading three zero zero runway two two right cleared for takeoff,6988.91,6994.56,
N42U,LCW-2,roger three zero zero,6994.72,6996.28,
LCW-2,GAA378,bizex three seventy eight boston tower runway two two right taxi into position and hold,6996.52,7000.51,
