from,to,text,time_start,time_end,comment
GAA378,LCW-2,position and hold three seventy eight,7000.61,7001.76,
LCW-2,N42U,navajo four two uniform fly heading three zero zero contact departure,7041.92,7045.64,
N42U,LCW-2,going to departure,7045.66,7046.43,
LCW-2,GAA378,bizex three seventy eight runway two two right ah cleared for takeoff,7047.06,7050.52,
GAA378,LCW-2,cleared to go bizex three seventy eight,7051.34,7052.93,
LCW-2,SWR127,swissair one two seven heavy boston tower cross runway two two right continue to runway two two left monitor tower frequency one two eight ah make that one one niner point one after crossing,7063.78,7072.61,
SWR127,LCW-2,roger cleared to cross ah two two right and after crossing one one nine one swissair one two seven heavy,7073.18,7081.41,
LCW-2,GAA378,bizex three seventy eight do you have that navajo that previously departed ahead to your right,7097.63,7101.69,
GAA378,LCW-2,yes sir we do,7102.83,7103.77,
LCW-2,GAA378,you do the same,7119.0,7119.92,
FDX75,LCW-2,tower express seventy five heavy is ready in sequence,7120.11,7122.29,
LCW-2,DAL326,delta three twenty six boston tower cross runway two two right contact ground point niner,7122.47,7126.47,
DAL326,LCW-2,cross the right ah point nine on the other side twenty six,7126.56,7129.3,
LCW-2,FDX75,express seventy five heavy boston tower roger,7129.33,7131.48,
FDX75,LCW-2,thank you,7159.38,7159.93,
LCW-2,COA366,continental three sixty six boston tower cross runway two two right contact ground point niner,7182.0,7185.99,
LCW-2,COA366,continental three sixty six cross runway two two right contact ground point niner this is boston tower,7189.61,7193.65,
