from,to,text,time_start,time_end,comment
PXX791,LCW-1,one nine zero after departure position and hold two two right pan am seven niner one,2066.55,2069.71,
LCW-1,PXX791,pan am seven ninety one wind two five zero at one seven runway two two right cleared for takeoff,2074.35,2078.11,
PXX791,LCW-1,cleared for takeoff two two right pan am seven niner one,2078.8,2080.68,
LCW-1,GAA467,bizex four sixty seven boston tower runway two two right taxi into position and hold traffic will cross down field prior to your release,2082.24,2086.58,
GAA467,LCW-1,position and hold two two right four sixty seven,2087.08,2089.25,
LCW-1,USA1227,u s air twelve twenty seven your similar sounding company call sign of seventy seven last two digits will also be on the departure frequency turn left heading one four zero and contact departure u s air twelve twenty seven,2089.28,2099.56,
USA1227,LCW-1,u s air twelve twenty seven we copy ah cleared to departure good day,2099.66,2103.15,
LCW-1,GAA335,bizex three thirty five traffic will hold in position off your right cross runway two two right contact ground point nine,2137.44,2141.27,
GAA335,LCW-1,traffic in sight cross two two right bizex three thirty five,2141.35,2144.22,
LCW-1,USA290,air two ninety boston tower traffic will hold in position off your right cross runway two two right contact ground point nine,2144.31,2148.19,
USA290,LCW-1,u s air two ninety is cross,2148.46,2149.5,
LCW-1,PXX791,pan am seven ninety one fly heading one niner zero contact departure,2149.62,2152.59,
PXX791,LCW-1,one ninety departure pan am seven ninety one so long,2153.2,2155.1,
LCW-1,GAA467,bizex four sixty seven turn right heading two six zero wind two four zero at one five runway two two right cleared for takeoff,2180.89,2186.07,
GAA467,LCW-1,right head two six zero cleared for takeoff four sixty seven,2186.35,2188.82,
LCW-1,USA510,u s air five ten boston tower runway two two right taxi into position and hold,2188.81,2191.5,
USA510,LCW-1,position and hold u s air five ten,2191.58,2192.99,
LCW-1,USA510,u s air five ten traffic ahead will be in a right turn westbound wind two four zero one eight runway two two right cleared for takeoff turn left heading one four zero,2226.69,2232.58,
LCW-1,GAA467,bizex four sixty seven turn right heading two six zero contact departure,2234.91,2238.3,
GAA467,LCW-1,right two sixty four sixty seven,2238.57,2240.73,
LCW-1,TPS1131,trump eleven thirty one boston tower runway two two right taxi into position and hold,2240.96,2243.82,
TPS1131,LCW-1,position and hold trump eleven thirty one,2244.1,2245.53,
LCW-1,USA510,u s air five ten contact departure,2276.47,2278.38,
USA510,LCW-1,thank you officer good night,2278.46,2279.61,
LCW-1,DAL457,delta four fifty seven boston tower cross runway two two right traffic will hold in position contact ground point nine,2286.47,2290.81,
LCW-1,DAL457,delta four fifty seven boston tower,2293.27,2294.75,
DAL457,LCW-1,delta four fifty seven is with you,2295.05,2296.18,
LCW-1,DAL457,delta four fifty seven cross runway two two right contact ground point nine,2296.36,2299.16,
DAL457,LCW-1,cross two two right point nine the other side delta four five seven,2299.39,2301.87,
LCW-1,DAL457,delta four fifty seven you will observe traffic holding in position off your right side as you cross the runway,2305.03,2309.03,
DAL457,LCW-1,delta four five seven roger,2309.38,2310.88,
LCW-1,TPS1131,trump eleven thirty one turn left heading one four zero runway two two right cleared for takeoff,2329.98,2333.24,
TPS1131,LCW-1,turn left one four zero cleared for takeoff trump eleven thirty one,2333.61,2336.43,
LCW-1,COM896,commuter eight ninety six boston tower runway two two right taxi into position and hold,2336.61,2339.21,
COM896,LCW-1,position and hold ah eight ninety six,2339.42,2341.57,
LCW-1,COM896,commuter eight ninety six turn right heading two niner zero runway two two right cleared for takeoff,2391.35,2396.85,
COM896,LCW-1,okay ah two ninety on the heading cleared for takeoff eight ninety six,2397.09,2399.68,
LCW-1,TWA810,t w a eight ten heavy boston tower traffic departing off your right side there taxi to runway two two left monitor tower one one niner point one,2401.4,2407.35,
TWA810,LCW-1,taxi to two two left t w a eight ten heavy one nineteen one,2409.75,2413.23,
LCW-1,TPS1131,trump eleven thirty one contact departure,2415.14,2417.17,
TPS1131,LCW-1,eleven thirty one so long now,2417.21,2418.55,
LCW-1,NERA3769,nera thirty seven sixty nine boston tower traffic ahead is crossing the runway caution wake turbulence taxiing heavy tri star taxi into position and hold runway two two right traffic will cross down field,2418.95,2426.03,
NERA3769,LCW-1,okay nera thirty seven sixty nine position and hold two two right,2426.06,2428.88,
LCW-1,SWR127,swissair one twenty seven heavy boston tower cross runway two two right contact ground point nine traffic will hold in position off your right,2429.04,2433.64,
SWR127,LCW-1,swissair one two seven heavy we cross two two right and ah we hold on the other side confirm,2434.98,2440.93,
LCW-1,SWR127,swissair one twenty seven heavy cross runway two two right turn right on the outer taxiway contact ground point nine,2441.19,2445.07,
SWR127,LCW-1,okay cross two two right right on the outer swissair one two seven heavy,2445.21,2448.46,
LCW-1,COM896,commuter eight ninety six fly heading two niner zero contact departure,2449.6,2452.08,
COM896,LCW-1,good night,2452.1,2452.54,
LCW-1,NERA3769,nera thirty seven hundred sixty nine wind two five zero at one seven runway two two right fly runway heading and cleared for takeoff,2486.47,2493.46,
NERA3769,LCW-1,on the roll nera thirty seven sixty nine,2493.62,2495.53,
LCW-1,NWA715,northwest seven fifteen boston tower runway two two right taxi into position and hold,2498.01,2500.79,
NWA715,LCW-1,position and hold northwest seven fifteen,2500.8,2502.67,
LCW-1,NERA3769,nera thirty seven sixty nine fly heading two two zero runway heading and contact departure,2535.36,2539.06,
NERA3769,LCW-1,two two zero over to departure good day,2539.1,2540.68,
LCW-1,NWA715,northwest seven fifteen traffic a mile off the departure end is on runway heading turn left heading one four zero wind two five zero one six runway two two right cleared for takeoff,2555.41,2563.53,
NWA715,LCW-1,left one forty cleared for takeoff northwest seven fifteen,2563.77,2566.48,
LCW-1,DAL378,delta three seventy eight boston tower runway two two right taxi into position and hold,2566.76,2569.52,
DAL378,LCW-1,three seventy eight say in position and hold two two right,2571.16,2573.05,
LCW-1,DAL378,delta three seventy eight affirmative boston tower,2573.29,2575.35,
LCW-1,USA431,u s air four thirty one traffic will hold in position boston tower cross runway two two right contact ground point nine,2611.51,2615.72,
USA431,LCW-1,cross the runway and ah u s air four thirty one,2616.27,2618.69,
LCW-1,NWA715,northwest seven fifteen turn left heading one four zero contact departure,2618.99,2621.98,
NWA715,LCW-1,northwest seven fifteen good night,2622.43,2624.04,
N58B,LCW-1,tower five eight bravo with you,2625.31,2626.6,
LCW-1,N58B,twin cessna four eight five eight bravo boston tower traffic will hold in position off your right cross runway two two right contact ground point niner after crossing,2632.76,2639.22,
N58B,LCW-1,five eight bravo roger,2639.78,2640.84,
LCW-1,CDN3814,canadian thirty eight fourteen boston tower traffic will hold in position cross runway two two right contact ground point niner,2641.1,2645.64,
CDN3814,LCW-1,cross the right one thirty eight fourteen,2645.72,2648.23,
LCW-1,DAL378,delta three seventy eight without delay wind two five zero at one niner runway two two right cleared for takeoff,2666.26,2671.03,
DAL378,LCW-1,cleared to go delta three seventy eight,2671.33,2672.86,
LCW-1,GAA377,bizex three seventy seven runway two two right taxi into position and hold,2685.9,2688.4,
GAA377,LCW-1,on and hold bizex three seventy seven,2688.77,2690.3,
LCW-1,GAA377,bizex three seventy seven turn right heading two niner zero runway two two right cleared for takeoff,2706.68,2710.53,
GAA377,LCW-1,right to two ninety cleared to go bizex three seventy seven,2710.55,2712.67,
LCW-1,N56Z,citation one two five six zulu boston tower runway two two right taxi into position and hold,2712.82,2716.79,
N56Z,LCW-1,position and hold citation one two five six zulu,2716.87,2719.18,
LCW-1,DAL378,delta three seventy eight contact departure,2721.54,2723.41,
DAL378,LCW-1,see you,2723.95,2724.43,
LCW-1,N56Z,citation five six zulu the traffic ahead will be in a right turn northwest bound turn left heading one four zero on departure runway two two right cleared for takeoff,2750.07,2757.11,
LCW-1,NERA3777,thirty seven seventy seven boston tower taxi into position and hold runway two two right,2761.44,2764.75,
NERA3777,LCW-1,position and hold two two right thirty seven seventy seven,2764.85,2767.59,
LCW-1,GAA377,bizex three seventy seven fly heading two niner zero contact departure,2767.61,2770.57,
GAA377,LCW-1,bizex three seventy seven good night,2770.72,2772.2,
LCW-1,NERA3777,nera thirty seven seventy seven runway two two right cleared for takeoff,2790.23,2793.07,
GAA367,LCW-1,bizex three sixty seven boston tower taxi into position and hold runway two two right,2795.6,2798.65,
GAA377,LCW-1,position and hold bizex three sixty seven,2799.01,2800.9,
LCW-1,N56Z,citation five six zulu turn left heading one four zero contact departure,2801.08,2804.83,
N56Z,LCW-1,one forty in the turn and ah to departure five six zulu good day you all,2805.17,2808.28,
LCW-1,GAA367,bizex three sixty seven fly runway heading until advised runway two two right cleared for takeoff,2843.29,2847.17,
GAA367,LCW-1,runway heading cleared to go bizex three sixty seven,2847.45,2849.45,
LCW-1,NERA3777,nera thirty seven seventy seven turn right heading three zero zero and contact departure,2849.9,2855.18,
NERA3777,LCW-1,three zero zero over to departure thirty seven seventy seven,2855.34,2858.48,
LCW-1,FAB921,first air nine twenty one boston tower runway two two right taxi into position and hold traffic will cross down field prior to your release,2858.67,2863.08,
FAB921,LCW-1,position and hold two two right first air nine twenty one,2863.19,2865.01,
LCW-1,NERA3728,nera thirty seven twenty eight boston tower traffic will hold in position off your right side cross runway two two right company is following you contact ground point nine,2877.15,2883.02,
NERA3728,LCW-1,cross two two right then over to ground have a good night,2883.05,2885.4,
LCW-1,NERA3719,nera thirty seven nineteen tower cross runway two two right contact ground point nine,2885.42,2888.61,
NERA3719,LCW-1,crossing two two right thirty seven ah nineteen,2888.64,2891.51,
LCW-1,GAA367,bizex three sixty seven turn right heading two seven zero and contact departure,2919.47,2923.92,
GAA367,LCW-1,two seventy good day bizex three sixty seven,2924.05,2925.95,
LCW-1,FAB921,first air nine twenty one wind two five zero one six runway two two right cleared for takeoff,2926.47,2930.8,
FAB921,LCW-1,cleared takeoff first air nine twenty one good day,2930.9,2932.6,
LCW-1,NWA46,northwest forty six heavy boston tower continue taxiing to runway two two left via november monitor tower on ah one one niner point one,2933.08,2940.61,
NWA46,LCW-1,via november two two left and ah switching northwest four six heavy,2940.92,2945.64,
LCW-1,GAA780,bizex seven eighty boston tower traffic will hold in position cross runway two two right contact ground point nine,2974.98,2979.49,
GAA780,LCW-1,seven eighty roger,2979.8,2980.87,
LCW-1,ACA808,air canada eight zero eight boston tower traffic will hold in position cross runway two two right contact ground point nine,2982.91,2986.99,
LCW-1,FAB921,first air nine twenty one turn right heading two niner zero contact departure,2992.24,2996.25,
LCW-1,ACA808,air canada eight zero eight if able expedite your taxi please,3009.24,3011.88,
LCW-1,ACA808,no problem air canada eight zero eight plan a right turn on the outer taxiway as you call ground,3015.65,3018.91,
ACA808,LCW-1,thanks,3019.42,3020.02,
GAA597,LCW-1,tower bizex ah five ninety seven is ah transitioning to runway two two right,3020.74,3024.21,
GAA597,LCW-1,continue for bizex five ninety seven roger,3028.1,3029.85,
LCW-1,PCN3539,precision thirty five thirty nine be ready for immediate runway two two right taxi into position and hold traffic is going to depart the parallel after you depart,3029.98,3035.45,
LCW-1,PCN3539,precision thirty five thirty nine runway two two right wind two five zero at one six cleared for takeoff,3043.4,3047.33,
LCW-1,GAA505,bizex five zero five ah boston tower you able an immediate,3050.13,3053.24,
GAA505,LCW-1,five zero five yes sir,3053.89,3054.97,
LCW-1,GAA505,just hold there for now i may have something for you very shortly bizex five zero five keep you advised company is on a mile final,3055.25,3060.27,
GAA505,LCW-1,okay we can do it,3060.3,3061.05,
LCW-1,GAA505,bizex ah five zero five runway two two right wind two five zero at one six cleared for immediate takeoff traffic on a one mile final for your runway traffic just departed the parallel,3078.94,3087.26,
LCW-1,GAA597,bizex five ninety seven company shorts is underway runway two two right cleared to land wind two five zero at one six,3097.74,3102.1,
GAA597,LCW-1,cleared to land for bizex five ninety seven we see him,3102.32,3104.37,
LCW-1,PCN3539,precision thirty five thirty nine turn right now heading of ah two niner zero contact departure,3105.31,3110.25,
PCN3539,LCW-1,two niner zero departure precision thirty five thirty nine,3110.66,3113.87,
LCW-1,USA1405,u s air fourteen zero five boston tower did you copy move up to the next hold line and hold please,3123.86,3127.42,
LCW-1,GAA505,bizex five zero five ah fly runway heading expect a turn here momentarily in fact do you have the dornier off to your right in sight,3134.51,3139.6,
GAA505,LCW-1,five oh five yes sir,3141.32,3142.29,
LCW-1,GAA505,five zero five roger turn right heading two four zero maintain visual separation with that traffic and contact departure good day,3142.47,3147.23,
GAA505,LCW-1,five oh five thanks good day,3147.94,3149.64,
LCW-1,UAL1559,united fifteen fifty nine boston tower runway two two right taxi into position and hold traffic will cross down field,3155.26,3159.67,
UAL1559,LCW-1,united fifteen fifty nine in position and hold runway two two right,3160.14,3163.77,
LCW-1,GAA597,bizex five ninety seven if able turn right on runway three two left or tango contact ground point nine,3169.22,3173.53,
BIZEX597,LCW-1,okay point niner off ah five ninety seven roger,3174.15,3176.62,
LCW-1,COA1192,continental eleven ninety two boston tower the u s air seven three will be moving momentarily follow him cross runway two two right traffic will hold in position contact ground point nine,3191.23,3198.06,
USA1405,LCW-1,tower fourteen oh five,3201.84,3203.14,
LCW-1,USA1405,u s air fourteen zero five boston tower cross runway two two right traffic will hold in position off your right side contact ground point niner,3203.78,3209.27,
USA1405,LCW-1,fourteen zero five cleared to cross,3209.38,3211.09,
LCW-1,UAL1559,united fifteen fifty nine hold in position runway two two right traffic is crossing down field caution wake turbulence heavy d c ten is departing the parallel,3240.29,3247.09,
LCW-2,UAL1559,united fifteen fifty nine runway two two right cleared for takeoff,3355.49,3359.08,
UAL1559,LCW-2,united fifteen fifty nine runway two two right cleared to go,3359.28,3362.67,
LCW-2,GAA420,bizex four twenty boston tower runway two two right taxi into position and hold after departure turn right heading three zero zero,3362.79,3368.74,
GAA420,LCW-2,three hundred after departure position and hold bizex ah four twenty,3369.13,3372.06,
LCW-2,GAA420,bizex four twenty runway two two right cleared for takeoff,3396.29,3399.18,
GAA420,LCW-2,cleared for takeoff bizex four twenty,3399.28,3400.57,
LCW-2,NERA3763,nera thirty seven sixty three boston tower runway two two right taxi into position and hold,3401.05,3405.68,
NERA3763,LCW-2,position and hold thirty seven sixty three,3406.0,3408.12,
LCW-2,UAL1559,united fifteen fifty nine contact departure,3409.83,3412.42,
UAL1559,LCW-2,united fifteen fifty nine is going over to departure,3413.09,3415.78,
LCW-2,GAA420,bizex four twenty fly heading three zero zero contact departure,3457.67,3461.14,
GAA420,LCW-2,good night bizex four twenty,3461.37,3462.66,
LCW-2,GAA420,good day,3463.11,3463.55,
LCW-2,NERA3763,nera thirty seven sixty three runway two two right cleared for takeoff,3524.3,3527.45,
NERA3763,LCW-2,cleared to go thirty seven sixty three,3527.66,3529.19,
LCW-2,NWA752,northwest seven fifty two ah heavy boston tower cross runway two two right contact ground point niner,3573.91,3579.27,
LCW-2,NERA3763,nera thirty seven sixty three turn right heading three zero zero contact departure,3586.46,3590.46,
NERA3763,LCW-2,three hundred over to departure thirty seven sixty three,3590.68,3592.97,
LCW-2,DAL492,delta four ninety two boston tower runway two two right taxi into position and hold traffic will cross down field,3659.77,3665.26,
DAL492,LCW-2,position and hold two two right delta four ninety two,3665.77,3668.08,
LCW-2,NWA390,northwest three ninety boston tower cross runway two two right traffic will hold full length contact ground point niner,3727.93,3733.75,
LCW-2,NWA390,northwest three ninety boston tower,3737.45,3739.32,
LCW-2,NWA390,northwest two ninety boston tower cross runway two two right traffic will hold in position contact ground point niner,3743.8,3748.74,controller misstates flight number
LCW-2,TST1,test flight one boston skyways,3763.5,3765.03,transmission not received from helicopter on another frequency
LCW-2,TST1,test flight one ah roger cleared into the boston t c a as requested proceed from present position direct to the ah city helipad boston altimeter is ah three zero zero eight say altitude,3776.03,3788.75,transmission not received from helicopter on another frequency
LCW-2,TST1,test flight one roger radar contact one one miles south of boston,3793.23,3797.03,transmission not received from helicopter on another frequency
LCW-2,DAL492,delta four ninety two runway two two right cleared for takeoff,3799.17,3801.64,
DAL492,LCW-2,delta four ninety two cleared for takeoff,3801.91,3803.48,
UAL752,LCW-2,seven fifty two is with you holding short,3804.55,3806.03,
LCW-2,DAL599,delta five ninety nine heavy boston tower runway two two right taxi into position and hold,3806.84,3810.47,
DAL599,LCW-2,delta five ninety nine heavy position and hold,3810.84,3812.74,
LCW-2,DAL599,delta five ninety nine heavy runway two two right cleared for takeoff,3841.74,3845.19,
DAL599,LCW-2,two two right cleared for takeoff delta five ninety nine heavy,3845.72,3847.86,
LCW-2,DAL492,delta four ninety two fly heading one four zero and contact departure,3850.06,3853.43,
DAL492,LCW-2,delta four ninety two,3853.81,3854.87,
LCW-2,PAA549,clipper five forty nine boston tower caution wake turbulence departing heavy boeing seven sixty seven runway two two right taxi into position and hold,3856.17,3862.78,
PAA549,LCW-2,position and hold clipper five forty nine,3862.88,3864.25,
LCW-2,UAL752,united seven fifty two heavy boston tower cross runway two two right traffic holding in position contact ground point niner,3895.89,3901.84,
UAL752,LCW-2,cross the right ah seven fifty two point nine the other side,3902.06,3904.67,
LCW-2,DAL599,delta five ninety nine heavy turn left heading one four zero contact departure,3905.17,3908.94,
DAL599,LCW-2,five ninety nine good night,3909.24,3910.27,
LCW-2,DAL599,good night to you,3910.37,3911.24,
LCW-2,PAA549,clipper five forty nine runway two two right cleared for takeoff,3985.3,3988.22,
PAA549,LCW-2,clipper five forty nine is rolling,3988.78,3990.17,
NWA48,LCW-2,and northwest forty eight heavy cleared to cross,3991.71,3993.81,
LCW-2,NWA48,northwest forty eight heavy ah affirmative cross runway two two right continue taxi to runway two two left monitor tower one one niner point one after crossing,3994.03,4002.5,
NWA48,LCW-2,nineteen one after crossing roger,4002.79,4004.52,
LCW-2,DAL730,delta seven thirty cross runway two two right contact ground point niner,4038.58,4042.49,
DAL730,LCW-2,delta seven thirty,4042.71,4044.27,
LCW-2,PAA549,clipper five forty nine fly heading one four zero contact departure,4045.22,4048.58,
PAA549,LCW-2,one forty over to departure clipper five forty nine,4048.65,4050.64,
LCW-2,NERA3729,nera thirty seven twenty nine boston tower runway two two right taxi into position and hold,4051.36,4055.53,
NERA3729,LCW-2,okay into position and hold two two right thirty seven twenty nine,4055.67,4059.47,
LCW-2,NERA3729,nera thirty seven twenty nine runway two two right cleared for takeoff,4073.94,4076.92,
NERA3729,LCW-2,thirty seven twenty nine cleared for takeoff two two right,4079.53,4081.7,
LCW-2,TST1,test flight one roger radar service is terminated frequency change approved wind at boston is two four zero at one seven,4121.94,4127.28,transmission not received from helicopter on another frequency
LCW-2,NERA3729,nera thirty seven twenty nine fly runway heading contact departure,4141.77,4144.58,
NERA3729,LCW-2,thirty seven twenty nine,4145.15,4146.29,
LCW-2,UAL20,united twenty heavy boston tower cross runway two two right contact ground point niner,4146.54,4149.83,
LCW-2,USA211,u s air two eleven boston tower give way to the ah heavy d c ten ahead to your right or off to your right side and ah make that off your left side cross runway two two right contact ground point niner,4152.46,4160.93,
USA211,LCW-2,u s air two eleven behind united,4162.4,4164.0,
LCW-2,USA211,that would have been easier huh,4165.33,4166.69,
LCW-2,N3AE,whiskey three alpha echo boston tower,4183.03,4184.84,transmission not received from aircraft on another frequency
LCW-2,COM856,commuter eight fifty six boston tower runway two two right taxi into position and hold traffic will cross down field,4236.78,4240.99,
COM856,LCW-2,on and hold commuter eight fifty six,4241.11,4242.72,
LCW-2,COM856,commuter eight fifty six runway two two right cleared for takeoff after departure turn right heading three zero zero,4284.29,4288.58,
LCW-2,GAA565,bizex five sixty five boston tower runway two two right taxi into position and hold caution wake turbulence ah departing heavy d c ten on the parallel runway,4295.57,4301.75,
GAA565,LCW-2,two two right position and hold bizex five sixty five,4302.08,4304.46,
LCW-2,TWA150,t w a one fifty tower,4315.05,4316.42,
TWA150,LCW-2,one fifty go,4316.79,4317.71,
LCW-2,TWA150,t w a one fifty roger hold short runway two two right,4317.77,4320.1,
TWA150,LCW-2,one fifty will hold short of two two right,4320.31,4321.92,
LCW-2,TWA150,t w a ah one fifty cross runway two two right now and contact ground ah point niner,4327.57,4332.31,
TWA150,LCW-2,okay cross the right and ah ground on the other side,4332.48,4335.31,
LCW-2,COM856,commuter eight fifty six fly heading three zero zero contact departure,4335.76,4338.98,
COM856,LCW-2,three zero zero and over to departure commuter eight fifty six,4339.59,4342.14,
LCW-2,CG1472,calling boston tower say again,4360.75,4362.28,
LCW-2,CG1472,coast guard air craft say again your call sign and request,4375.64,4378.19,
LCW-2,CG1472,coast guard one four seven two squawk five one two six and ident,4385.3,4388.7,transmissions not received from military aircraft on another frequency
LCW-2,USA1270,u s air twelve seventy boston tower cross runway two two right give way to the light aircraft ah left to right and contact ground point niner,4392.64,4398.95,
USA1270,LCW-2,cleared to cross and switch thank you we see him,4399.06,4401.11,
LCW-2,N3AE,whiskey nine three alpha echo boston skyways,4409.61,4411.81,
LCW-2,N3AE,whiskey three alpha echo ah five one two three on the squawk depart from present position ah or from the boston helipad cleared for takeoff the wind two five zero at one seven and the altimeter is ah three zero zero eight ah proceed to boston city helipad,4417.64,4432.17,transmissions not received from helicopter on another frequency
LCW-2,GAA565,bizex five sixty five after departure turn left heading one five zero runway two two right cleared for takeoff,4460.06,4468.1,
GAA565,LCW-2,one five zero two two right cleared for takeoff bizex five sixty five,4468.3,4471.12,
LCW-2,N3AE,whiskey three alpha echo is radar contact landing at city at your own risk the wind two five zero at one eight report landing assured,4471.3,4477.17,transmission not received from helicopter on another frequency
LCW-2,USA14,u s air fourteen proceed to the next set of hold bars and hold short acknowledge hold,4478.29,4481.89,
USA14,LCW-2,up to and short of the next hold bars u s fourteen,4482.22,4485.43,pilot used incomplete prefix
LCW-2,GAA814,bizex eight fourteen runway two two right taxi into position and hold,4485.62,4489.09,
GAA814,LCW-2,position and hold two two right bizex eight fourteen,4489.25,4491.4,
LCW-2,CG1472,coast guard one four seven two roger proceed inbound until radar identify,4506.96,4510.62,transmissions not received from military aircraft on another frequency
LCW-2,GAA814,bizex eight fourteen after departure turn right heading two five zero runway two two right cleared for takeoff,4512.7,4517.91,
GAA814,LCW-2,cleared for takeoff two two right ah two five zero bizex eight fourteen,4518.19,4521.5,
LCW-2,COM905,commuter nine zero five boston tower runway two two right taxi into position and hold,4521.5,4525.22,
COM905,LCW-2,into position and hold nine zero five roger,4525.52,4527.64,
LCW-2,USA14,u s air fourteen traffic holding in position full length cross runway two two right contact ground point niner,4550.73,4555.59,
